6925263637111;Luminária de mesa 22 leds BIGSPACE Nsbao
6925263637166;Ns Bao Luminaria De Mesa Touch Sem Fio 14 Leds Articulavel Com Clip Para Mesa E Bancada Com Luz Ajus
6925263637357;Não encontrado
6925263637487;Lampião à bateria recarregável 4 leds Nsbao 110v e 220V
6925263637494;Não encontrado
6925263637500;Mini Ventilador Portátil, Super Potente YG- 5318B NSBAO
6925263637517;Lanterna recarregável 20 leds 146 lúmens - YG- 5718 - Nsbao (110V/220V)
6925263637821;Lanterna de cabeça - YG- 5598 - Nsbao
6925263651100;Luminária de mesa, articulável YG- 5913P NSBAO
6925263651308;Raquete recarregável para insetos - Nsbao
6925263651438;Lampião Mata Mosquito Nsbao 110V e 220V
6925281901249;Harman kardon JBL Coluna Horizon (Preto)
6925281903250;JBL Control X
6925281903489;Par de caixas acústicas Torre para Home Theater JBL Arena 180
6925281903601;Caixa Jbl Arena Sub100 200Watts 10P
6925281903717;JBL Coluna GO (Preto)
6925281903748;JBL Coluna GO (Rosa)
6925281903762;JBL Coluna GO (Azul Escuro)
6925281903786;JBL Coluna GO (Azul Claro)
6925281904141;Harman/Kardon HKTS210SUB - Subwoofer Ativo 200W HKTS 210 SUB - Kardon
6925281904219;AKG Auscultadores N60 NC (Preto)
6925281904578;JBL Coluna Xtreme (Preto)
6925281904592;JBL COL XTREME RED
6925281905667;Fone de Ouvido YBIMINSPO- 4RNB - JBL
6925281907203;Fone de Ouvido JBL Reflect Mini In Ear com Microfone/Botão Universal Preto
6925281907210;Fone de Ouvido JBL Reflect Mini Vermelho
6925281907364;JBL Audio Subwoofer 12' JBL S2 1224 275 Watts RMS
6925281907432;Harman Kardon AVR1510S - Receiver 5.1ch / Internet / USB / 3D Ready / 4K
6925281907524;Harman Kardon AVR- 1710S - Receiver 7.2 canais com AirPlay e Bluetooth
6925281907777;Harman Kardon JBL AVR- 1010 - Receiver 5.1ch / 3D Ready / DLNA 5.1 / Internet
6925281908279;JBL Coluna Pulse 2
6925281910708;Módulo Amplificador De Potência Club Speakers 4 Canais 1000W Rms Jbl
6925281910722;Módulo Amplificador De Potência Club Speakers 4 Canais 1500W Rms Jbl
6925281910753;Alto Falante 6.5 Coaxial 100W RMS JBL CLUB- 6520
6925281910760;Alto Falante 6x9 Coaxial 160W RMS JBL CLUB- 9630
6925281910777;Alto Falante 3,5 Coaxial 40W RMS JBL CLUB- 3020
6925281910784;Alto Falante 4 Coaxial 60W RMS JBL CLUB- 4020
6925281910791;Alto Falante 5 Coaxial 80W RMS JBL CLUB- 5020
6925281910838;Kit 2 Vias 6,5 JBL CLUB- 6500C 120 Watts RMS
6925281912788;Headphone JBL Evereste 300 sem Fio Bluetooth com Controle Universal e Microfone Preto
6925281914195;JBL Coluna Wireless Charge 3 (Azul)
6925281914201;JBL Coluna Wireless Charge 3 - Vermelho
6925281914782;Caixa de Som Bluetooth - 1.0 - JBL Clip 2 Portable Bluetooth Speaker - Vermelha - JBLCLIP2RED
6925281915284;JBL Under Armour Heart Rate
6925281915376;Fone de Ouvido JBL C300
6925281916939;Soundbar JBL SB450 2.1 Canais Bluetooth Subwoofer Wireless
6925281917998;Fone de Ouvido - 3,5mm - JBL E15 - Preto - JBLE15BLK
6925281918094;JBL AUSC E 45 BLACK
6925281918117;Fone de Ouvido JBL E45BT On- Ear com Bluetooth Vermelho
6925281918742;JBL Auriculares T290 (Preto)
6925281918759;JBL Auriculares T290 (Prateado)
6925281918865;Microsystem Bluetooth JBL MS202 JBL
6925281918971;Headphone T450 OverEar JBL
6925281918988;Fone de Ouvido JBL T450 Supra Auricular Com Microfone e Bluetooth Preto
6925281919008;Fone De Ouvido Bluetooth JBL T450BT Azul
6925281919060;JBL Auriculares T210 (Cinza)
6925281919084;Fone de Ouvido Bluetooth JBL Duet BT Preto
6925281919091;Fone de Ouvido Bluetooth JBL Duet BT Branco com Dourado
6925281919107;Fone de Ouvido Bluetooth JBL Duet BT Prata
6925281921087;Fone de Ouvido Original Jbl E25bt Preto In Ear com Bluetooth
6925281922404;Coluna Bluetooth JBL Flip 4 - Azul
6925281922435;Coluna Bluetooth JBL Flip 4 - Vermelho
6925281922442;Coluna Bluetooth JBL Flip 4 - Preto
6925281922657;Caixa de Som Bluetooth JBL FLIP4 Bluetooth Azul
6925281923203;Coluna Wireless JBL Charge 3 - Squad
6925281923326;Caixa de Som Bluetooth à Prova D'agua JBL Clip 2 Squad
6925281923388;Caixa de Som Portátil Multifunções JBL Tune - Preto, Alto- falante, Bluetooth, com Leitor de Cartão
6925281923401;Caixa de Som Portátil Multifunções JBL Tune - Prata, Alto- falante, Bluetooth, com Leitor de Cartão
6925281924040;Caixa de Som Portátil JBL Box Xtreme Malta - 40W, com Bluetooth, Resistente a Água, Edição Especial
6925281924101;Fone de Ouvido Intra- auricular JBL T290 P2 Champagne
6925281924132;JBL Inspire 500
6925281924309;JBL Auriculares T290 (Rosa Dourado)
6925281924408;Caixa Acústica JBL Bluetooth 16W Flip 4 Squad
6925281924415;Caixa Acústica JBL Bluetooth 16W Flip 4 Mosaico
6925281924446;Caixa de Som Portátil JBL Flip 4 - 16W RMS, Malta
6925281924507;JBL Auriculares T210 (Rosa Dourado)
6925281925047;Caixa De Som Bluetooth Light Show JBL Pulse 3 Preta 20W
6925281925054;Caixa De Som Bluetooth Light Show JBL Pulse 3 Branca 20W
6925281925368;Fone de Ouvido Bluetooth JBL E55BT Quincy Edition JBLE55BTQEBLK
6925281927041;Soundbar JBL 3.1 Canais com Bluetooth, Som Surround e Entradas HDMI - 178W
6925281927416;Fone de Ouvido Sem Fio JBL Soundgear Neckbands Preto - JBLSOUNDGEARBLK
6925281927522;Soundbar JBL BAR 5.1 - 510W RMS, Bluetooth, SoundShift, Subwoofer sem Fio, Entrada HDMI/AUX/USB - Bi
6925281928055;Fone de Ouvido JBL T110BT - Pure Bass e Bluetooth - Branco
6925281928062;Fone De Ouvido Bluetooth JBL T110BT Branco
6925281928338;Fone De Ouvido In ear JBL T205 Preto
6925281928352;Fone De Ouvido In ear JBL T205 Rose Gold
6925281928369;Fone De Ouvido In ear JBL T205 Champagne Gold
6925281928574;Fone de Ouvido INFANTIL JBL T450 Vermelho
6925281928598;Fone De Ouvido Bluetooth INFANTIL JBL JR 300 BT Rosa
6925281928604;Fone de Ouvido Infantil JBL Jr300 On Ear - Azul
6925281928833;Fone de Ouvido Sem Fio JBL Headphone com Noise Cancelling em Couro Preto - JBLDUETBTNCBLK
6925281929014;Fone De Ouvido Bluetooth JBL Everest 310 Gun Metal
6925281929038;Fone de Ouvido sem Fio JBL Everest Elite V750nc Over Ear - Preto
6925281930157;Não Informado Fone De Ouvido Bluetooth E65 BT NC Com Cancelamento de Ru?dos
6925281930317;Fone de Ouvido JBL Under Armour Flex Intra- auricular Preto - JBLUNDERARMOURFLEX
6925281931840;Caixa De Som Bluetooth Jbl Go 2 Portátil Original - Azul
6925281931888;Caixa de Som JBL GO 2 Bluetooth 3W
6925281931932;Caixa de Som Portátil JBL Box GO 2 - 3W RMS - Verde, Bluetooth, À Prova D'água
6925281932007;Caixa de Som Bluetooth Portátil Preto GO 2 JBL
6925281932021;Harman Caixa de Som Portátil JBL Xtreme com Conexão Bluetooth à Prova D’água – 40W
6925281932045;Harman Caixa de Som Portátil JBL Xtreme com Conexão Bluetooth à Prova D’água – 40W
6925281932182;Fone De Ouvido Bluetooth JBL com Cancelamento de Ruído Tune 600 BT NC Preto
6925281932199;Headphone Bluetooth T600 White JBL
6925281932397;Fone de Ouvido BTH Everest Elite V150 Preto JBL
6925281932960;Caixa de Som JBL Boombox Bluetooth Preto
6925281933028;Caixa de Som Bluetooth Clip 3 Black JBL à Prova d'Água
6925281933035;Caixa de Som Bluetooth Clip 3 Blue JBL à Prova d'Água
6925281933042;Caixa de Som Bluetooth Clip 3 Red JBL à Prova d'Água
6925281933127;Não Informado Caixa de Som Bluetooth com Chromecast Playlist Preta JBL
6925281933233;Fone de Ouvido Endurance Run Red JBL
6925281933271;Fone de Ouvido Bluetooth Endurance Sprint Red JBL
6925281933318;Fone de Ouvido Bluetooth Endurance Jump Black Red JBL
6925281933356;Fone de Ouvido Sem Fio JBL Endurance Dive BNL Intra- Auricular Vermelho e Cinza - JBLENDURDIVERED
6925281933837;Fone de Ouvido Bluetooth T205BT Preto JBL
6925281933851;Fone de Ouvido BluetoothT205BT Champagne JBL
6925281933868;Fone de Ouvido BTH T205BT Rose JBL
6925281934896;Caixa de Som Bluetooth JBL Xtreme 2 com Potência de 40W Preta - JBLXTREME2PTO
6925281934919;Caixa de Som Bluetooth JBL Xtreme 2 40W RMS À Prova D'água
6925281935268;Caixa de Som Bluetooth JBL Turner FM com Potência de 5W para Android, iOS e Windows Phone Preta - JB
6925281936289;Fone de Ouvido Endurance Run Blk Yellow JBL
6925281936340;Fone de Ouvido Bluetooth Live200BT Preto JBL
6925281936364;Fone de Ouvido Bluetooth Live200BT Branco JBL
6925281937255;Fone de Ouvido Bluetooth Endurance Sprint Black JBL
6925281937279;Fone De Ouvido Mp3 1Gb Bluetooth Jbl Endurance Dive Á Prova D'Àgua
6925281938597;Fone de Ouvido Sem Fio JBL Everest 310GA com Google Assistant Headphone Cinza - JBL V310 GABT GML
6925281939211;Fone de Ouvido Reflect Mini 2 BT Black JBL com Bluetooth e Resistente ao Suor
6925281939228;Fone de Ouvido Reflect Mini 2 BT Blue JBL com Bluetooth e Resistente ao Suor
6925281939693;Caixa de Som Bluetooth JBL Party Box 200 - JBLPARTYBOX200BR
6925281939921;Fone de Ouvido JBL T500 Headphone Preto - JBLT500BLK
6925281939938;Fone de Ouvido JBL T500 Headphone Branco - JBLT500WHT
6925281939952;Fone de Ouvido JBL Tune500BT Headphone Preto - JBLT500BTPTO
6925281944154;Caixa de Som JBL Xtreme 2, Bluetooth - Unissex
6925625421822;Relógio Digital Portátil Kenko Car Clock Automotivo
6925625438844;Calculadora 12 Dígitos Eletrônica Kenko KK- 1048- 12
6925749709127;Não encontrado
6925749716101;Não encontrado
6925749751508;Jpcell Mouse Gamer Laser 6 Botao 3200 Dpi Ótico Usb Alta Precisão
6925781422664;Chtech - Aurora Fragmentadora Aurora As618sb- 1 Linha Pessoal 110v
6925781423289;Chtech - Aurora Fragmentadora Aurora de Papel,cartão e CD Em Tiras (110v) As810sd - 1
6925781423500;Chtech - Aurora Fragmentadora de Papel Corte Em Tiras As600s Para 6 Folhas A4 + Cartão (110v)
6925781423517;Chtech - Aurora Fragmentadora Aurora de Papel Corte Em Partículas Para 8 Folhas A4 + Cartão (110v)
6925781423524;Chtech - Aurora Fragmentadora de Papel Corte Em Tiras As600s Para 6 Folhas A4 + Cartão (220v)
6925781423531;Chtech - Aurora Fragmentadora Aurora de Papel Corte Em Partículas Para 8 Folhas A4 + Cartão (220v)
6925781423609;Fragmentadora AS1018CD- 1 com cesto, corta partículas 10 folhas + Tritura cartão e CD (110V) - Auror
6925781452876;Aurora Refiladora De Papel Ast 405
6925873200903;Balança Digital Bioland EB9010 Vidro até 150kg
6925970700245;Fone de Ouvido Esportivo Flexível Philips - SHQ4300OR Laranja
6925970700283;Fone de Ouvido Esportivo Gancho Ajustável Philips SHQ3300LF cinza
6925970700290;Fone de Ouvido Esportivo Haste de Apoio SHQ4300LF/00 Verde Philips
6925970700801;Marca Padrão Fone de Ouvido Philips Headphone DJ Lifestyle SHL3060BL/00
6925970701310;Fone de Ouvido com Microfone NO Cabo SHL3565BK/00 Preto Philips
6925970703468;Fone de Ouvido Wireless Bluetooth com Microfone Integrado SHB3060WT/00 Branco Philips
6925970708067;Fone De Ouvido Com Microfone Preto She1405bk- 10 Philips
6925970709538;Fone de Ouvido Esportivo 3 em 1 SHQ1400LF/00 Branco e amarelo Philips
6925970709576;Fone de Ouvido Esportivo 3 em 1 com Microfone SHQ1405BL/00 Azul Philips
6925970710251;Fone De Ouvido Headband On Ear Com Microfone Shl4805dc/00 Preto Philips
6925970712415;Fone de Ouvido Philips Bass+ SHL3075BK - Preto, com Microfone
6925970712439;Headphone/Fone de Ouvido Philips Bluetooth - com Microfone Bass+
6925970712446;Headphone/Fone de Ouvido Philips Bluetooth - Sem Fio Wireless Bass+ Branco
6926391989264;Compressed Bag Kit 10 saco a vácuo 80x60cm organizador roupa edredom cama
6926528430164;BMAX Tomada 12v Usb 5v Para Moto Carregador de Celular e GPS
6926528484990;Mini Lanterna B- MAX Multifunções BM- 8499
6926625500128;Não Informado Cabide De Veludo 30 Peças Ultrafino Anti Deslizante
6926688200362;Represent Fone de Ouvido 5 em 1 Wireless
6926720607173;Caderno Frozen Fever 10x1 - 200 Folhas - Jandaia Mod.03
6926799203092;Botafogo Colchão Inflável Casal
6926799211301;Outros Piscina infantil inflavel com cobertura para crianca e bebe macaquinho 65 litros
6926799211714;Barbie - Praia Boia Glamourosa Média - Fun Divirta- se
6926799212186;28 Jilong Sports Arena - Kinder Spiel Arena, Hüpfburg, für Kinder von 3 - 6 Jahren, 155x155x189 cm
6926799214180;Wellmix Bote Inflável Carro de Polícia com Assento para Bebê
6926799214722;Fun Piscina Barbie 68 Litros
6926799214746;Piscina inflável infantil 180 litros SEAWORLD Botafogo
6926799215897;Fun Boia De Braço Barbie
6927556279275;Não encontrado
6927556279282;Não encontrado
6927556279336;Trampolim 4,20 M Cama Elástica Rede de Proteção Pula Pula BRINK
6927869577570;Não encontrado
6927869577655;Não encontrado
6928026420005;Cofre Eletrônico Safewell 8 Litros 20 EK - Preto
6928026420012;Cofre Safewell Eletrônico 25 EK, modelo Anti- roubo - Preto
6928026420029;Cofre Eletrônico Safewell 30 EK Preto
6928026420043;Cofre Antifogo Safewell YB500ALD
6928026420104;Cofre Anti- Roubo Safewell Modelo Ad42A Preto
6928026420111;Cofre Anti- Roubo Safewell Modelo Ad26B Preto
6928026420159;Cofre Anti- Roubo Safewell Modelo Ad63B Preto
6928026420197;Cofre Eletrônico Safewell 20 MB - Tela de Led, Preto
6928026420203;Cofre com Tela em Led Safewell 25 MB
6928026420210;Safewell Cofre Eletrônico com Tela em LED Modelo - 30 MB
6928026420227;Cofre Eletrônico com Tela de LED - 25 EID - Safewell
6928026420234;Cofre Eletrônico com Tela Led Safewell 30 EID Azul
6928026420241;Cofre Eletrônico com Tela Led Safewell 20 EID Azul
6928026420258;Cofre Estilo Refrigerador Safewell 320 BBX
6928026420272;Cofre com Biometria Safewell 25 FPN
6928026420289;Cofre Safewell 30 FNP com Impressão Digital - Safewell
6928026420319;Cofre para Gaveta Safewell DS - S01 - Preto
6928026420326;Cofre para Automóveis Safewell CS 220 - Preto
6928026420364;Cofre para Armas Safewell 1450BQG- 8
6928026420371;Cofre para Chaves Safewell 71 KS
6928026420449;Cofre Para Automóveis 15 R Safewell
6928196305829;Kasilar Balança De Precisão Digital 1g A 10kg
6928568963138;Tigela infantil MumLove com ventosa e talheres Rosa
6930096600034;Telescópio Newtoniano Equatorial 1000X114mm com Tripé e Acessórios - Greika TELE 1000114
6930096600188;Telescópio Equatorial Refrator Greika F90070EQ com Tripé e Acessórios
6930444801038;Huion Kamvas Pro 13 graphics tablet
6930512171018;Berço Tenda Portátl Com Mosquiteiro Color Baby
6930673172107;Não Informado Porta Joias - Caixa Organizadora Anéis Bijuterias Brincos
6930819504670;Não Informado Fone de ouvido dobravel bestaudio preto
6930864613266;Coifa de Parede Cuisinart Prime Cooking Led 90cm 4092740100
6930864629663;Domino a Gas Cuisinart Prime Cooking PFA310 30cm Inox com 1 Boca Tripla
6930864631635;Forno Elétrico Multifunções Cuisinart Casual Cooking 60cm 220V F104E3IX- C70- 96
6931858720021;Game Max GP400A 400w 80 Plus Bronze Wired Power Supply
6931858771030;Gabinete Gamemax HG602 White Hero Lateral Acrilico Usb 2x2.0/1x3.0 4 Fans + 1 Fan 32 Leds transparen
6931858782012;Monitor Gamer GAMEMAX 27 Pol. LED Curvado 144Hz 1Ms Full HD, GMX27C144 PRETO
6931858790284;Cooler Gamemax Rf12- X 21 Leds 12Cm Rgb Ring
6931858790291;Cooler Gamemax CL 400 kit 4 com Controle Remoto
6932011061388;Controle para PS2 Feir Wireless FR- 204
6932170681229;ENCANTO Boia para copos - Donut
6932177467871;HOOPSON Calculadora 12 Dígitos PS- 2420 com Luz Teste de Nota Falsa
6932177469219;HOOPSON Calculadora de mesa 8 dígitos PS- 2808A
6932177469257;Arco e flecha Cronômetro Digital Kadio KD1069
6932391901779;Não Informado Mouse Usb Laser Gamer Usb 6 D M418 Marvo
6932391904534;Mouse Usb Gamer 1600 Dpi 6 Botoes Led Azul M205 Marvo
6932391908983;Não encontrado
6932849427349;Roteador Tenda Wireless Dualband 1200 Mbps AC6 Preto - Wi- Fi de 5ª geração, Tenda Cloud, Tenda App
6932849427554;TDA Roteador Tenda Wireless Dual Band (2,4 e 5 GHz) 1200 Mbps Ac5
6932849427684;Extensor de Area Wireless Tenda A9 300 Mbps 2 antenas externas
6932849429237;TDA Roteador Tenda Load Balance VPN QoS G3
6932849431049;TDA Switch Ethernet Tenda S105 5 Portas 10/100mbps
6932849431056;Switch Tenda S108 8 Portas 10/100
6933163302763;Não Informado Termostato Para Aquário Resun Sunlike 50w 110V
6933412726210;Deepcool maelstrom 240
6934043945131;Não encontrado
6934177702877;Pulseira Inteligente Xiaomi Mi Band 3 Preta
6934300900170;Não encontrado
6934585684468;Refrigerador LG Frost Free Side By Side GS65SDN New Lancaster 601 Litros 3 Portas Aço Escovado
6934585684475;Refrigerador LG Frost Free Side By Side GS65SDN New Lancaster 601 Litros 3 Portas Aço Escovado
6934781200363;Bomba submersa sunsun jtp 12000r 12000l/h 220v para aquário
6934781203333;Bomba submersa sunsun jtp 7000r 7000l/h 220v para aquário
6934781203968;Bomba Submersa Sunsun Hj- 311 300l/h 2w 110v
6934781287456;Filtro Interno Sun Sun de 1000 Litros hora
6934781298018;Bomba Sun Sun Submersa de 1600 Litros/hora - 110 V
6935364001056;Adaptador de Rede TP- Link TF- 3200 PCI 10/100 - Prata
6935364002176;Power Bank TP- Link 10400mAh
6935364010065;TP- LINK UH700 HUB 7P USB 3.0
6935364020071;Adaptador TP- Link Wireless USB 150Mbps TL- WN721N
6935364020255;Hub Switch 5 Portas Gigabit Eth Tl- sg1005d Código 10765 Tp- link
6935364020293;Switch 16 Portas 10 100Mbps Full Duplex TP- Link TL SF1016D
6935364020491;TP- Link JetStream TL- SL3428 24- Port 10/100Mbps + 4- Port 10/100/1000Mbps L2 Managed Switch (Versi
6935364021153;TP- Link Desktop Switch Gigabit 8- Portas TL- SG108
6935364021160;Switch 8 portas TP- LINK TL- SG1008P 4 Portas POE Gigabit 10/100/1000Mbps Rack
6935364021474;Hub Switch 24 Portas Eth Tl- Sf1024 10/100 - Código 3507 Tp- link
6935364021634;TP- Link Switch TP LINK 8 Portas TL SG3210 10 100 1000MBPS TPL0200
6935364021993;Switch Tp- link 24 10/100 Mbps + 4 Portas Giga Tl- sl5428e
6935364022037;TP Link Tp- link Hub Switch 05p Tl- sg105e Switch Easy Smart Gigabit
6935364022129;Switch 16 Portas 10/100/1000MBPS Gigabit TL- SG3216 - TP- Link
6935364030414;Conversor de Mídia Cabo de Cobre para Fibra MC111CS TP- LINK
6935364030445;Conversor de Midia Modo Unico Mc210cs - Código 11587 Tp- link
6935364030506;Injetor PoE TL- POE150S TP- Link
6935364031039;Servidor de Impressao Wireless Tl- wps510u Código 11398 Tp- link
6935364031985;TP- Link PLC Powerline AV500 Nano Starter Kit TL- PA4010KIT
6935364032241;TP- Link PLC Powerline AV500 WiFi WPA4220
6935364032258;TP- Link PLC Powerline AV500 Wireless N300 Extender Starter Kit TL- WPA4220KIT
6935364040413;Roteador Gigabit TL- R470T+ TP- LINK
6935364040437;Roteador TP- LINK TL- R480T+ Cabeado 5 Portas MULTI- WAN
6935364050368;TP- Link Adaptador USB Wireless N300 TL- WN821N
6935364050467;TP- Link Adaptador USB Wireless N150 TL- WN722N
6935364050511;Adaptador PCIe WiFi TP- Link TL- WN781ND, 150 Mbps, 1 antena
6935364050559;Adaptador USB TL- WN723N Mini TP- Link
6935364050566;Adaptador Wireless TP- Link PCI - 150 Mbps
6935364050573;Adaptador PCI Express Wireless TL- WN881ND de 300 Mbps Tp- Link
6935364050740;Adaptador TP- LINK Wireless TL- WN8200ND USB 300MBPS TPL0172
6935364050863;TP- Link Adaptador USB Wireless AC1200 Dual Band Archer T4U
6935364050962;TP- Link Router Wireless AC750 Archer C2
6935364051402;Access Point N 150Mbps - TP- Link
6935364051419;Access Point 300 Mbps Tl- wa801nd Código 10229 Tp- link
6935364051853;Roteador Wireless TP Link TL MR3040 3G 150MBPS
6935364051983;Repetidor de Sinal Wireless 300mbps TLWA850RE - Tp- Link
6935364052164;TP- Link Antena OMNI Direcional Interna TL ANT2408C 2 4GHZ 8DBI de Mesa
6935364052195;Antena Omnidirecional 2.4GHz 8dBi TL- ANT2408CL TP- LINK
6935364061166;Modem Roteador Wireless ADSL2+ TP- Link N 300Mbps TD- W8961N para Rede sem Fio
6935364070113;Roteador Dual Band TP- Link TL- WDR3500, 600Mbps, 2 antenas, 1 porta USB
6935364070199;TP- Link Range Extender Universal Wireless N300 WA850RE
6935364070601;TP- Link Router Wireless AC1750 Archer C7
6935364070625;Roteador TP- Link TL- WR841HP 300 Mbps Alta Potência
6935364080259;Switch Tp- link 08 10/100/1000 PoE 2 SFP L2 Gerenciável (T1500G- 10PS)
6935364080730;Roteador Wireless Tp- Link Archer C20 Ac750 Dual Band 750mbps
6935364081065;Roteador TP- Link Archer C50 AC1200 Wireless Dual Band 2,4/5GHz 4 Ant Fixas
6935364091620;Access Point de Teto 300 Mbps Eap110 - Código 11591 Tp- link
6935364091675;Roteador TP- LINK ARCHER C50 Dual BAND Wireless AC 1200MBPS TPL0328
6935364091798;Switch tp- link mesa 5 portas gigabit tl- sg1005d
6935364091811;Modem e Roteador Wi- Fi TP- Link Archer D20 Dual Band 2 Antenas
6935364091972;Switch 24 Portas Smart Gigabit C/4 Slots Sfp Combo TL- SG2424 Tp- link
6935364091996;Switch SMART TP- LINK TL- SG2452 Gigabit de 48 Portas com 4 SLOTS SFP
6935364092047;Roteador Wireless Dual BAND + ADSL AC1200 ARCHER C5 TP- LINK
6935364092290;Tp Link Router Touch P5 Ac1900 Dual Band Gigabit
6935364092498;TP-LINK T2600G-28TS
6935364092535;TP- Link Modem Roteador Wireless N VDSL2 USB 300Mbps TD- W9970
6935364092559;Adaptador Tp- Link Archer T6E Wireless 1300Mbps
6935364093327;Roteador Wireless 3 Antenas USB Gigabit TL- WR1043ND TP- Link
6935364093839;Extensor de Area TP- LINK TL- WA855RE 300MBPS Wirelless 2,4GHZ
6935364096755;Roteador Wireless TP- Link Archer C60 com Velocidade de 1350MBps, Dual Band (AC 5GHz e N 2.4GHz) , 5
6935364096915;Access Point TP- LINK EAP225 Teto Wireless AC1200 Dual Band 2,4/5Ghz Gigabit 2 Ant. Ommi 4dBi
6935364099947;Router WiFi Alta Potencia MW330HP 3 Antenas Mercusys
6935482109016;Não encontrado
6935539601326;Não encontrado
6936116000556;Isapa Ciclocomputador Absolute Irix 10 Branco Com Fio
6936257203564;Pedal Afinador Cromatico Nux - Pt- 6 Tuner
6936257205247;Pedal NUX Roctary - Rotary e Poly- Octave - PD1066
6936257205421;Pedal de Efeito Monterey Vibe Mini Core NCH1 NFA- 3832 - Nux
6936257205452;Pedal de Guitarra Nux Rivulet chorus NCH- 2
6936258251427;Não encontrado
6936852189669;PAN L Transmissor FM para carro com controle remoto Modulador T701 Preto
6937671781591;Ar Condicionado Janela Gree 18000 BTUs Frio Mecânico
6937671781607;Ar Condicionado Janela Gree 21000 BTUs Frio Mecânico
6938628217958;Jogo de 4 Rodas de Liga Leve ZK- 560.Bd Aro 15 Zunky
6938818300798;Módulo de Expansão EXP40 para o SIP- T46G e SIP- T48G - Yealink
6938818301191;Telefone IP SIP- T21P/E2 Sem Fonte Yealink
6938818301634;Telefone IP Giga com Display Touch SIP T58V Yealink
6939020440876;Lanterna Holofote DP LED- 1706 19 Leds
6939020440968;D P Led Lanterna cabeça 12 Led marca D P modelo 722 B
6939020441231;Mercoriental Calculadora PS- 4123 Hoopson
6939020445598;HOOPSON Calculadora de mesa 12 dígitos PS- 8880B
6939020446984;Headphone Profissional com Microfone Hoopson F- 014PT/20
6939020447127;Fonte ATX 650w Hoopson Com LED FNT- 650w
6939020447318;Mouse Sem Fio Hoopson MS- 031
6939020447400;Hoopson Mouse Gamer Gx- 58 2400Dpi
6939020447462;Mercoriental Headphone Headset Gamer c/ Microfone GA- 1*
6939020447578;Headphone Hoopson Bluetooth Simply Life Sem Fio F- 038B
6939020447585;Não encontrado
6939020447981;Não encontrado
6939020448056;Não encontrado
6939020448087;HOOPSON Kata GX18 Programável
6939020448629;Não encontrado
6939184632407;Tiras Reagente Glicosimetro G500 50und Bioland
6939184642383;Micro Lanceta Bioland Glicosimetro G- 423L - 100 Unidades
6939184650005;Kit Medidor de Glicose Bioland Ref. G- 500
6939184650012;Glicosímetro com Memória para 500 funcionários, Cabo USB - Bioland
6939184657714;Oxímetro De Dedo Portátil At101c Bioland
6939605200093;Não Informado Caneta Detectora De Cédulas Falsas
6940091946792;Barbie Massinha Food Truck Sorvetes E Delícias Rosa Fun
6940091961139;Fun Massinha Cupcake Divertido Barbie
6940091961221;Brinquedo Comidinha Divertida Massinhas Barbie KD6122 Fun
6940091961269;Barbie - Massinha Aniversário da Barbie - Fun Divirta- se
6940091961306;Massinha Donuts Da Barbie Fun Divirta- Se
6940929800098;MARCUS & MARCUS Tigela Fundo Dobrável Silicone Girafa
6940929800678;Não encontrado
6941057400334;Piscina Desmontável 6.503L Metal Galvanizado Com Fitlro 127V Intex
6941057400341;Piscina Desmontável 6.503L Metal Galvanizado Com Fitlro 220V Intex
6941057401911;Braçadeiras Intex Frozen
6941057402178;Boia Wet Set Intex
6941057402185;Braçadeiras Intex Neon
6941057402208;Baby Bote Conforto (assento fralda) 56585 Intex
6941057402215;Desportos aquáticos Intex Volley Pool Game
6941057402307;Colchão Inflável Lounge Cores 9985 - Intex
6941057402321;Acessórios de praia Intex Fridge Mega Chill
6941057402383;Piscina Infantil Por do Sol 28L Redondo - Intex
6941057402413;Desportos aquáticos Intex 3 Rings Inflable Pool
6941057402468;Desportos aquáticos Intex Spray Jardin
6941057402543;Piscina Snapset Dinossauros 2089L - Intex
6941057402864;Braçadeiras Intex Cars
6941057402956;Intex Baby Bote Peixinhos
6941057402987;Bote Realistic Gator 12459 - Intex
6941057402994;Piscina Tartaruga Marinha - Intex
6941057403014;Bote Cisne 12453 - Intex
6941057403458;Packs Intex Adventure View Set Junior
6941057403588;Bote Flamingo Rosa Gigante Para até 2 Pessoas - Intex
6941057403601;Colchões de praia Intex Inflatable Watermelon
6941057403939;Acessórios Intex Easy Set Pool Cover
6941057403946;Acessórios Intex Easy Set Pool Cover
6941057403960;Acessórios Intex Easy Set Pool Cover
6941057404028;Acessórios Intex Rectangular Pool Cover
6941057404035;Acessórios Intex Deluxe Cover
6941057404059;Acessórios Intex Easy Set/metal Frame
6941057404141;Bomba Filtrante Piscina Intex 1250 LH 220v Filtro Incluso Cod #28602
6941057404165;Bomba Filtrante INTEX 2006 LH 110v #28603
6941057404271;Bomba Filtro Intex Sistema de Areia Krystal Clear 6m3/h 220v #28646
6941057404554;Acessórios Pool Chemical Dispenser
