6941057404561;Acessórios Pool Chemical Dispenser
6941057404585;Acessórios Collect Leaves
6941057404806;Colchão para Piscina Picolé 12457 - Intex
6941057405063;Intex Piscina PRISM de Armação de Metal Galvanizado 4.485L (Bomba Filtro 220/240V)
6941057406077;Bomba Filtro Intex Sistema de Areia Krystal Clear 110v 6.000 L/H #28645
6941057407463;Intex Bote Unicórnio Grande
6941057407487;Desportos aquáticos Intex Inflatable Emoji
6941057407579;Não Informado Colchão Inflável Ice Cream 58762 Intex
6941057408606;Não Informado Colchão Inflavel para Piscina - Batatas Fritas - Intex
6941057408620;Desportos aquáticos Intex Inflatable Berry Pink
6941057420004;Acessórios Filter Cartridge 59900/29000
6941057420226;Acessórios Intex Easy Set Pool Cover
6941057426044;Importado Bomba Filtro P/Piscina Armacao E P/Piscina Easy Set 12' 220V
6941057429007;Acessórios Intex Filter Cartridge
6941057444741;Acessórios Intex My First Gym
6941057446691;Teimoso Inflavel 3D Dragão 91cm INTEX
6941057451091;Desportos aquáticos Intex Fish Baby Pool
6941057452203;Boia Intex com Cabeça de Animais Sortidos com 1 Unidade
6941057452302;Importado Boia 051Cm Intex
6941057452425;Importado Boia 061Cm Intex
6941057453323;Bote Explorer 300 - Intex
6941057454092;Piscina do Bebê 15L Intex
6941057454467;Desportos aquáticos Intex Inflable 3 Rings Pool
6941057454498;Desportos aquáticos Intex 3 Rings Pool
6941057454535;Importado Piscina 244X46Cm 2089L Intex
6941057454719;Desportos aquáticos Intex Aquarius Pool
6941057455709;Bóia Baby Bote Animais c/ Fralda Tartaruga - Intex
6941057455747;Intex Baby Bote Meu Primeiro Bote
6941057455860;Intex Baby Bote Inflável Kiddie - Bombeiro
6941057456263;Importado Boia 114Cm Caminhao Monstro Intex Com 2 Alcas
6941057456508;Importado Boia De Braco Golfinho Intex Par
6941057456614;Colete Inflável Intex Peixinhos
6941057456713;Importado Colete Deluxe Intex
6941057457031;Intex Inflatable Pool Lilo
6941057457413;Desportos aquáticos Intex Sunsset 3 Rings Baby Pool
6941057458021;Colchão inflável King Cool 9970 - Intex
6941057458946;Acessórios de praia Intex Inflable Mattress 18 Glasses
6941057459240;Desportos aquáticos Intex Sunsset 3 Rings Baby Pool
6941057463056;Caiaque Inflável Challenger com Remo - Intex
6941057463063;Caiaque Infl?vel Intex Challenger K2 + Par De Remos + Bomba De Inflar #68306
6941057463254;Bote Barco Inflavel Excursion 5 Com Remos Alumínio - Intex
6941057463513;Bote Infl?vel Intex Seahawk 4 Com Par De Remos E Bomba De Inflar #68351
6941057463735;Bote Mariner 3 Set (297 x 127 x 46) com Acessórios - Intex
6941057463766;Bote MARINER 4 Intex #68376 04 Pessoas Fundo Rígido Remos Bomba
6941057465647;Acessórios Intex Ultra Lounge Armchair With Footrest
6941057466125;Acessórios de praia Intex Hand Pump Double Quick I
6941057466248;Acessórios barcos Intex Motor Support
6941057466316;Motor El?trico Para Bote Infl?vel Intex 12V Mariner Seahawk Excursion Challenger #68631
6941059605928;Smartphone Xiaomi Redmi 6A 16 GB Dourado
6941059605942;Smartphone Xiaomi Redmi 6A Dual Chip 16Gb Azul
6941059614579;Smartphone Xiaomi MI 8 LITE 6,26 Quad Core 6 GB RAM 128 GB Negro
6941855202628;Boyu Filtro Mochila Wf- 2035 300L/h 80 Gr
6941920132911;Constant Jarra de Medir Eletrônica Digital de LCD Preta
6942138900033;Best Way Bola de Praia Inflável Tradicional Grande - 61cm
6942138900118;Bóia Inflável Bestway Pequena Golfinho - Infantil - AZUL
6942138900422;Piscina Kiddie Pool 3 Níveis - Bestway
6942138900606;insuflÃ¡veis para Fentoys Porteria Piscina
6942138900996;Best Way Bote Boia Barco Praia Piscina Bestway
6942138903256;Boia Circular Transparente Azul - Bestway
6942138903942;Poltronas Piu Piu + Mesinha - Bestway
6942138903959;Bote Infantil Peixe - Bestway
6942138906141;Piscina Mickey Mouse 167L Multicores - Bestway
6942138906196;Pula-Pula Inflável Bestway Mickey - Vermelho/Azul Cla
6942138906905;Piscina Infantil Bestway 38 Litros Disney Mickey
6942138906936;Echolife Bóia Circular Pneu Velocity 1,19cm C/ Alça 36102
6942138908077;Bote Infantil Bombeiro - Bestway
6942138908671;Bote Infantil Bestway Disney Princesas
6942138908701;Piscina Princess 167 Litros Rosa 91047 - Bestway
6942138908718;Piscina Redonda Bestway Semi Rígida Princess 354 L - Colorida
6942138908756;Bestway Piscina Fast Set 1080 Litros Princesas
6942138908947;Óculos de Natação Hydro- Force Hydros Goggles - Bestway
6942138910421;Banheirinha Comfort Azul 51116 Bestway - Echolife
6942138910445;Piscinas para AFT Piscina infantil com Parasol
6942138911381;Bestway Colchão de Praia Bastway Homem- Aranha
6942138911763;Bote Inflável Homem Aranha - Intex
6942138911909;Mangas e bÃ³ias para Cladellas Brazalete Jungle
6942138912098;Jet Ski Inflável Bestway Homem Aranha - Infantil - AZUL/VERMELHO
6942138913514;Colete Salva-Vidas Inflável Bestway Homem Aranha - Infantil - AZUL/VERMELHO
6942138913941;Piscina Bestway 23 Litros Joaninha Guarda- Sol
6942138913958;Best Way Pula Pula Inflável Bestway Play Center Bouncer #52182
6942138914795;Best Way Kit de Mergulho Infantil Bestway 3 Peças
6942138915655;Piscina Inflável 140L 51025 Bestway Sortida
6942138915662;Piscina Inflável 282L 51026 Bestway Sortida
6942138915815;Piscina Inflável 62 Litros Bestway - Art Brink
6942138915839;Art Brink Bóia com Assento Amarela 32027 - Bestway
6942138917567;Mangas e bÃ³ias para Cladellas Brazalete Minnie 25X15
6942138917581;Best Way Bóia Circular Minnie 56cm 891758 Bestway
6942138917796;Bomba Manual de Ar Bestway 3 Bicos
6942138918182;Lona para Chão Bestway Ground Cloth 58000 2,74m x 2,74m
6942138918243;Capa Bestway para Piscina 2,67 M 2,44 M 2300 L 2419 L 105 BW
6942138918250;Capa Bestway para Piscina 3,35 M 3,05 M 3638 L 3853 L BW
6942138918267;Capa Bestway para Piscina 3,80 M 3,66 M 5377 L 6844 L BW
6942138918274;Capa para Piscina 457 cm Fast Set - Azul Bestway
6942138919356;Embreagens e carros alegÃ³ricos para AFT Gorro Natacion NiÃ±o Little Buddy
6942138919479;91001 Bestway Bola De Praia Disney Mickey 51Cm
6942138919486;Bóia de Braço Mickey 15x23cm 91002 Bestway Echol
6942138919493;Boia Circular Mickey Mouse Bestway
6942138919530;Boia de Braço Bestway Disney Princesas
6942138921267;12560 Bestway Piscina Inflável Fast Set 1.000L 168X51cm
6942138922981;Fisher Price Boia de Braço 25 Cm x 15 Cm - Fun Divirta- se
6942138922998;Fisher Price Colete 51 Cm x 46 Cm - Fun Divirta- se
6942138924220;Best Way Boia Infantil Divertida Patinho Amarelo 1,35m x 91cm
6942138925814;Fisher Price Bóia Circular 69 Cm - Fun Divirta- se
6942138927092;Bestway Colchão Inflável Infantil Disney Minnie
6942138927658;Zein Colete Inflável Minnie Bestway
6942138927955;Fisher Price Colete de Natação Feminino - Fun Divirta- se
6942138928068;Boia de Cintura 51cm Aventuras no Mar 36113 Bestway Sortida
6942138928761;ZEIN Bestway Piscina Bestway Fast Set 2.300 litros
6942138928969;Piscina Bestway Estrutural 6.473 Litros com Filtro 1249LH
6942138929973;Filtro para Piscina Bestway 2006 Litros Hora 58383 – 220V
6942138930238;Bóia de Braço Inflável Bestway Golfinho - Infantil - LARANJA
6942138930450;Bote Infantil Animais - Bestway
6942138934274;Bestway 36116
6942138934410;Bóia Submarino 41098 Bestway
6942138934618;Helicóptero Inflável Com 25 Bolinhas Fisher Price 8013 4
6942138939064;Bóia de Cintura Donuts 36118 Bestway Sortida
6942138940046;Best Way Boia Baleia Jumbo 41009 Bestway
6942138940084;Bote Inflável Golfinho Bestway
6942138940183;Bestway 42005
6942138940275;Colchão Inflável para Piscina Bestway Copo Color
6942138940480;Poltrona Lisa 1,83 x 69cm Azul 44007- Bestway
6942138950014;Best Way Piscina Inflável 3 Anéis 140 Litros Bestway Peixes Praia
6942138950205;Toca Barraca Cabana Casa Infantil Criança Best Way
6942138951226;Kit 02 Cartuchos para Bomba Filtrante Bestway 1249 LH 220v Modelo 'I' Codigo
6942564466097;Não Informado Relógio de Mesa c/ Despertador Led Azl
6942644307357;Disfarce para Calvície Castanho Escuro Super Billion Hair
6942902700449;Não encontrado
6943206700388;Pedal de Guitarra Joyo JF- 11 6 Band Equalizador
6943206702344;Pedal de guitarra Joyo JF- 34 Us Dream
6943206702511;JOYO R-01 Tauren Overdrive Guitar Effect Pedal
6943206702535;Joyo R-03 Uzi Distortion High Gain 3 Band EQ Bias Control Friedman BE-OD Clone
6943206703099;Pedal de guitarra Joyo Boogie Master Amp Simulator
6943206703297;Pedal Guitarra Ironloop Joyo JF- 329
6943206703327;Joyo Pedal Moonbase overdrive para contrabaixo
6943206703501;Pedal Guitarra D- seed Joyo
6943206703518;Joyo Technology Joyo BanTamP Vivo
6943206750277;Cabeçote Joyo Hibrido valvulado VIVBO 20 W Bluetooth
6943206770046;Pedal PHASER/VIBRATO FIRE
6943206770114;Pedal Guitarra Lancelot Joyo D- 59
6943206790037;Pedaleira Mooer Bem Box para Contrabaixo
6943206790105;Pedal Mooer Ensemble King Analog Chorus Mekac Original
6943206790280;Pedal Mooer Reecho Digital Delay Mrdd Original
6943206790624;Pedal Mooer Graphic B Bass
6943206790822;Pedal Mooer de Guitarra Noise Killer
6943206791317;Pedaleira para Guitarra Mooer GE- 100, com Fonte Bivolt
6943206792055;Pedaleira Mooer de Efeitos Red Truck
6943757609628;Robô Aspirador de Pó Ecovacs Robotics D95R- N 30W Bivolt Cinza
6943757610136;Robô Aspirador de Pó Ecovacs Robotics DA3G 15W Bivolt Bivolt Verde Hortelã e Branco
6945647901010;HTC Termômetro Com Higrômetro E Relogio Temperatura Umidade Hora
6946943863668;Cadeira de Descanso Premium Azul até 11,5 Kg Mastela
6946943864184;Mastela Cadeira De Descanso Musical E Vibratória Girafa 11Kg
6946943865587;Mastela Cadeira Automática Com Timer Animais Do Jardim
6946943868762;Mastela Cadeira Musical E Vibratoria Macaco
6946943869035;Cadeira de Descanso Rocker Rosa até 18kg Mastela
6946943869059;Cadeira De Descanso e Balanço 18 Kg Rosa Mastela
6946943869073;Cadeira de Descanso Mastela Musical Rocker Rosa
6946943869097;Cadeira de Descanso Rocker Estampada Marrom até 18kg Mastela
6946943869103;Cadeira de Descanso Rocker Estampada Marrom até 18kg Mastela
6946943872165;Cadeira de Descanso Portátil 7216 até 11kg Mastela
6946943872202;Cadeira de Descanso Girafa até 11,2kg Mastela
6946943872219;Cadeira de Descanso Leão até 11,2kg Mastela
6946943873605;Banheira Flexível Mastela Rosa
6946943881914;Ibimboo Banheira Spa para Recém Nascido Mastela 8191
6946943883505;Mastela Tapete Infatil - Rosa Borboleta
6947110912202;Iluminador Profissional de Leds Yongnuo YN1200 com fonte
6947110912226;Iluminador Ring Light Pro Yongnuo Yn608 com Fonte
6947110912257;Flash Macro Twin Yongnuo YN24EX para Canon
6947110912271;Iluminador Ring Light Pro Yongnuo Yn308 com Fonte Obrigatórias
6947110912615;Anneau LED Pro 2 en 1 Yongnuo YN508 - 3200K- 5500K
6947110918280;Yongnuo YN-300
6947110919218;YONGNUO Flash TTL para Canon com Rádio e Led YN968EX- RT
6947214820038;Hongyan Iluminador Profissional de Led 160 + Bateria F550 + Carregador
6947273701354;Teléfono IP Grandstream GXP2140
6947273701866;Grandstream Small Business HD 2- Line IP Phone, GS- GXP1628
6947273702146;Telefone IP Grandstream GXP1615
6947299519209;Pedal Single mapex mars series P600
6947299526535;Pedal de Bumbo Mapex Simples P 400
6947663401895;Tabela WinMax de Basketball
6947663402021;Raquete Badminton Iniciante WinMax RBINC Ahead Sports - Rosa
6947663405015;Skate Classic Z1 Amarelo WinMax WME05015Z1 Ahead Sports
6947663405794;Patins In line WinMax WME05794A2S Rosa P
6947663407040;Óculos para natação (Regular) - Winmax - WMB07040H - Preto
6947663407521;Kit De Mergulho Infantil WinMax Azul WMB07521D Ahead Sports
6947663408061;Jogo de dardos Magnético WinMax WMG08061 Ahead Sports
6947663408474;Dardos em Pet GRAG00N 18 G WinMax WMG08474 Ahead Sports
6947663408818;Mesa de Pebolim GRAFFIT WinMax
6947663408856;Mesa Air Hockey Média Intermediária Wmg08856 Winmax
6947663408870;Mesa de Multi- Jogos Wmg08870 Winmax
6947663409013;Joelheira P WinMax WMF09013S
6947663409075;Modeladora Beatty Supporter WinMax MODL Ahead Sports P
6947663409624;Expansor Peitoral Ahead Sports WMF09624 WinMax
6947663409815;Abdominais Sit Up Ahead Sports WMF09815 WinMax
6947663410576;Bola De Futebol Americano Neoprene WinMax Ahead Sports Laranja
6947663417247;Bomba de Mão Para Encher Pneus WinMax Ahead Sports Preto
6947663450275;Kit Jogo de dardo Gabinete WinMax WMG50275 Ahead Sports
6947663450282;Case Kit com Dardos 18 G PET WinMax WMG50282 Ahead Sports
6947663450374;Dardo de Aço 22G Softip WinMax WMG50374 Ahead Sports
6947663451012;Raquete Badminton FlexPro 401 WinMax RBFLEX Ahead Sports - Azul
6947663451401;Apoio para Flexão Push Up Bar WinMax
6947663452019;Raquete Badminton Glassfiber- WinMax WMY52019 Ahead Sports
6947663452330;Raquete Tênis De Mesa 1 Estrela WinMax Ahead Sports
6947663452378;Raquete De Tênis De Mesa 1 Estrela WinMax Ahead Sports Vermelho
6947663469598;Joelheira Ahead Sports WMF09013M WinMax
6947663469673;Luva WinMax de Musculação
6947663472130;Raquete Badminton Iniciante WinMax RBINC Ahead Sports - Amarelo
6947663472192;Óculos para natação Regular WinMax WMB07040 Azul
6947663472277;Bola De Futebol Americano Neoprene WinMax Ahead Sports Preto
6947663472406;Skate Classic Z3 WinMax WME05015Z3 Ahead Sports
6947663472413;Skate Classic Z4 WinMax WME05015Z4 Ahead Sports
6947663472475;Capacete Para Ciclismo WinMax PVC CAPMAX Ahead Sports Vermelho
6947663472659;Patins Quad WinMax Base Alumínio Rodas em Gel Ahead Sports.
6947663473205;Pochete em Neoprene Com Duas Squeezes Preta WMF73205 Winmax
6947681527508;Smartphone Motorola X Style 32GB Tela 5.7 Polegadas Câmera 21MP XT1572 Branco Bvolt
6947681540019;Smartphone Motorola Moto G5 Dual 32GB Tela 5 Câmera 13MP XT1671
6947681542693;Smartphone Motorola Moto C Dual Sim 16gb Tela 5.0 Cam 8mp – Preto
6948344910231;Não encontrado
6948344910255;Não encontrado
6948344910774;Não Informado filtro externo aleas xp06 250l/h 220V
6948344910804;Não encontrado
6948344940993;Cerâmica Alta Porosidade Jeneca 500g para Filtro de Aquário
6948530113811;Suporte TV LCD, Led e Plasma de 17' a 42' Articulado Preto até 35Kg PSW735 - Loctek
6949418920750;Color Baby Cadeira de Descanso Balanço e Fixo Rocker - Rosa
6949999839021;SHOCK Kit Farol de Milha Vw Gol Voyage Saveiro G5 com Moldura Cromada
6949999839083;Farol Shocklight Vw Fox / Crossfox 2003 > 2009 Botão Modelo Original
6949999839243;Shocklight Kit Farol Milha Botão Original Corolla 09 10 11 Aro Cromado
6949999839335;Shocklight Kit Farol Milha Gol Voyage G6 a partir 2012 Friso Cromado
6949999839410;Shocklight Kit Farol Milha Botão Original Cobalt Onix Spin Sonic Novo Prisma
6949999839564;SHOCK LIGHT Kit Farol Milha S10 Trailblazer 2012 2014 2015 Neblina
6949999839625;SHOCK LIGHT Kit Farol de Milha Fox 2014 Bt Redondo Original + Moldura Cromada
6949999839816;Kit Farol De Milha City 2015 Sl- 111410 Shocklight
6949999839854;Kit Farol De Milha New Fit 2014 Sl- 111510 Shocklight
6949999839878;SHOCK LIGHT Kit Farol de Milha VW Novo Fox 2015/2016 Botão Original
