673419280488;2 in 1 LEGO Technic Racing Yacht
673419280938;76110 Lego Super Heroes - Batman: Ataque Dos Garras
673419280945;76109 Lego Super Heroes - o Veículo do Homem Formiga
673419281232;LEGO Ninjago - Street Race Snake Jaguar - 70639
673419281799;Jurassic World - A Fuga Do Laboratório - 75927 Lego
673419281928;LEGO The Hulkbuster: Ultron Edition
673419281942;75951 Lego Animais Fantásticos - a Fuga de Grindelwald
673419282123;LEGO Super Heroes - Disney - Marvel - Star Lord Vs Nebula - 76090
673419282185;Lego Ninjago - 70650 - Asa Do Destino
673419282444;Lego Ninjago - 70647 - Masters Of Spinjitsu Kai Mestre Dragão
673419282697;LEGO Creator - Espetáculo de Acrobacias Móvel - 31085
673419282819;31083 Lego Creator - Aventuras No Cruzeiro
673419282826;LEGO Creator - 3 em 1 - Férias de Inverno - 31080
673419283403;10876 Lego Duplo - Aventuras do Homem Aranha e Hulk
673419283984;Duplo Jurassic World - Zoológico De Gigantes Mansos - 10879 Lego
673419284066;LEGO Juniors - DC Comics - Coringa Ataque na Bat Caverna - 10753
673419284103;LEGO Juniors - Jurassic World - Caminhão de Resgate Raptor - 10757
673419292535;LEGO Thinking - Fundo do Oceano - 10404
673419292627;CONCIERTO DE LEGO Juniors Concierto de Ariel 10765
673419301909;LEGO Fire Truck
673419302029;LEGO Bricks and Ideas
673419302074;LEGO Futuristic Flyer
673419302098;LEGO Deep Sea Creatures
673419302104;LEGO Sunset Track Racer
673419302265;LEGO Ultrakatty & Warrior Lucy!
673419302296;LEGO Movie 2 Sweet Mayhem's Building Set
673419302920;LEGO Batman Batsub and the Underwater Clash
673419303088;LEGO Captain America: Outriders Attack
673419303095;LEGO Avengers: War Machine Buster
673419303101;LEGO Avengers: Iron Man Hall of Armor
673419303118;LEGO Marvel Avengers Ultimate Quinjet
673419303231;LEGO Rescue Helicopter
673419303460;LEGO Olivia's Heart Box
673419303521;LEGO Construction Loader
673419303767;LEGO Super Hero Spider-Man Car Chase 76133 | Shopko
673419304344;LEGO Minecraft Skeleton BigFig with Magma Cube
673419304450;LEGO The End Battle
673419304535;LEGO 2018 Dodge Challenger SRT Demon and 1970 Dodge Charger R T
674204052792;Não encontrado
0010847180049;Bohning 67492 7 in. Large Arrow Wrap, Neon Yellow - Pack of 13
0037995674923;67492 Proform Crankshaft turning socket fits Chevy big block
0096361674929;1994 Dodge Colt A/C Compressor 4- Seasons Dodge A/C Compressor 67492
3233620674925;Guichet lumineux Lumière acier brossé Art d'Arnould 67492
3700752480415;67492, Set écrous roues noir 17mm Hpi Racing pr buggy et truggy Trophy/Vorza
4002408674926;Barrena 67492 Ø 90mm - ERGOLINE
4944258674926;Non communiqué Écrou de roue Hot Bodies 67492 (jeu de 4) , 17 mm, noir
5055840973682;1inch Sq. Dr. Metric Bi- Hexagon Socket 36mm 67492
5707286228306;67492 Nissens Car Radiator Thermal engine cooling
6942138923292;Bestway 67492
67742100511;Não foi possível retornar o EAN do produto
678358660155;Mandala Jogos Deterrence 2X62 Jogo Nacional!
678358660193;Não encontrado
6789033340003;Suporte para carro Suporte plastico para latas e garrafas
681619700675;Iluminadores para The Balm Luminizer Betty Lou Mainzer
681619802669;Sobrancelha para The Balm Brow Pow Blonde
681619802676;Pó de Sobrancelhas Brow Pow da theBalm (Vários tons) - Light Brown
681619802683;Sobrancelha para The Balm Brow Pow Dark Brown
681619806483;Sombra em Bastão The Balm Batter Up Dugout - Feminino
682430400102;Voss Artesian Water Still 500ml
6825410656180;Não encontrado
682607535149;Monitor de Glicose Semi Completo sem Tiras com Lancetador, 10 Lancetas e Solução Controle On Call Pl
682895305486;Caixa Gesso Klipsch R- 2650- WII Inwall 6.5 Polegada UNI
683318941847;Não encontrado
6853701150079;Knup Kit bateria recarregável e cabo para controle de Xbox 360 Slim.
685387365807;AcessÃ³rios vÃ¡rios Ksix Griffin Survivor Case For Ipad 1 & 2 Black
685642645194;Dead Man's Doubloons - Board Game - Funbox
689076475549;Pedal de Efeito ADI- 21 - Behringer
6900009061382;Barbeador Máquina de Barbear Aparador nova Hair Clipper
6900214000039;Importado Fonte AC Adapter de alimentação para Xbox 360 110v - Super Slim
6900214003016;Fonte de Alimentação para XBOX 360 Slim Bivolt 110v 220v 135W Feir
6900214003047;MF Imports Cabo Hd Av Xbox 360 Audio Video Alta Qualidade Definição
6900580100296;Não encontrado
6900829074128;Não encontrado
6901016938384;Importado Bateria 9V HW Caixa com 10 Unidades
6901234567885;Tomate Suporte Universal Para Carros MP4 GPS PDA CELULAR
6901685786606;Não encontrado
6901763600060;Mini Caixa de Som Resistente a Agua Bluetooth MP3 com Suporte para Atender Chamadas Preto Bluetooth
6901893801412;Sinoart Extensor + Apontador de Lápis Maries Azul
6902016010193;Não Informado Placa de Textura Emboss 10,6x15cm Flor Margarida com Coração
6902016010278;Não Informado Placa de Textura Emboss 10,6x15 - Modelo Flor de Cabo Longo
6902016011435;Não Informado Fita Adesiva Permanente Dupla Face com Aplicador 10mts
6902150140060;Naninha de Plush Joaninha - Sonho de Luz
6902150140206;Sonho de Luz Babador cachorrinho marrom e branco
6902150140336;Naninha de Plush Cachorrinho - Sonho de Luz
6902150140404;Sonho De Luz Régua de Crescimento Zebra
6902315422420;Filtro Ultravioleta Hopar Uv 5w Aquários Lagos - 110v
6902315422468;Filtro Hopar Ultra Violeta UV- 611 de 9W - 611 de 9W 110V
6902341116164;Skate Infantil Monster High 76474 Fun
6902505201118;Empório Grampo Telefônico para Telefone Fixo e Celular 4 GB
6902505201125;Empório Micro Câmera Espiã com Sensor de Movimento Aparelho Espião
6902505201149;Empório Escuta Espiã à Distância Transmite ao Vivo até 100 metros
6902505201156;Empório Pendrive Espião com Sensor de Voz Mini Escuta Espiã 8 GB
6902505201187;Emporio Forte Equipamento Espião para gravar chamadas telefônicas ligações
6902505201224;Emporio Forte Aparelho Espião de Detetive com Mini Câmera Discreta 16 GB
6902505201231;Empório Câmera de Filmagem Espiã para Filmagem Oculta e Discreta 8GB
6902505201712;Empório Gravador Espião De Alta Autonomia com Sensor de Voz
6902505201743;Empório Mini Gravador de Conversas Espião Produto de Detetive
6902586565659;Global Fonte de Alimentação para Playstation 2 7000 Series Bivolt
0029176026768;6903 NSK RILLENKUGELLAGER
0038081053936;Alfred 00-6903 Christmas Miniatures- Book 1 - Music Book
0043972506903;Marque Generique Stroker Lifetime Silicone - Chaire Mangasm 6903
0049797846675;Beck Arnly 101- 6903 S65 Amg Control Arm
0052987003178;Lat Mens Fine Jersey Pocket T- Shirt 6903 - Black - M
0052987003192;Lat Mens Fine Jersey Pocket T- Shirt 6903 - Heather - M
0052987003208;Lat Mens Fine Jersey Pocket T- Shirt 6903 - Navy - M
0052987003215;Lat Mens Fine Jersey Pocket T- Shirt 6903 - Red - M
0052987003222;Lat Mens Fine Jersey Pocket T- Shirt 6903 - White - M
0052987003239;Lat Mens Fine Jersey Pocket T- Shirt 6903 - Black - S
0052987003253;Lat Mens Fine Jersey Pocket T- Shirt 6903 - Heather - S
0052987003260;Lat Mens Fine Jersey Pocket T- Shirt 6903 - Navy - S
0052987003277;Lat Mens Fine Jersey Pocket T- Shirt 6903 - Red - S
0052987003284;Lat Mens Fine Jersey Pocket T- Shirt 6903 - White - S
0052987003291;Lat Mens Fine Jersey Pocket T- Shirt 6903 - Black - L
0052987003314;Lat Mens Fine Jersey Pocket T- Shirt 6903 - Heather - L
0052987003321;Lat Mens Fine Jersey Pocket T- Shirt 6903 - Navy - L
0052987003338;Lat Mens Fine Jersey Pocket T- Shirt 6903 - Red - L
0052987003345;Lat Mens Fine Jersey Pocket T- Shirt 6903 - White - L
0052987003352;Lat Mens Fine Jersey Pocket T- Shirt 6903 - Black - Xl
0052987003468;Lat Mens Fine Jersey Pocket T- Shirt 6903 - Heather - Xl
0052987003475;Lat Mens Fine Jersey Pocket T- Shirt 6903 - Navy - Xl
0052987003482;Lat Mens Fine Jersey Pocket T- Shirt 6903 - Red - Xl
0052987003499;Lat Mens Fine Jersey Pocket T- Shirt 6903 - White - Xl
0052987003505;Lat Mens Fine Jersey Pocket T- Shirt 6903 - Black - 2xl
0052987003529;Lat Mens Fine Jersey Pocket T- Shirt 6903 - Heather - 2xl
0052987003536;Lat Mens Fine Jersey Pocket T- Shirt 6903 - Navy - 2xl
0052987003543;Lat Mens Fine Jersey Pocket T- Shirt 6903 - Red - 2xl
0052987003550;Lat Mens Fine Jersey Pocket T- Shirt 6903 - White - 2xl
0052987003567;Lat Mens Fine Jersey Pocket T- Shirt 6903 - Black - 3xl
0052987003581;Lat Mens Fine Jersey Pocket T- Shirt 6903 - Heather - 3xl
0052987003598;Lat Mens Fine Jersey Pocket T- Shirt 6903 - Navy - 3xl
0052987003604;Lat Mens Fine Jersey Pocket T- Shirt 6903 - Red - 3xl
0052987003611;Lat Mens Fine Jersey Pocket T- Shirt 6903 - White - 3xl
0080479256986;HP RM1-6903-OEM LaserJet P1102W Paper Delivery Tray Assembly
0080694440535;Mavic Parts Mavic Nabenlager HR 608 + 6903 - M40075
0082617024266;A1 Cardone 20- 6903 Power Steering Pump
0087295169032;NGK - 6903 - Bujía de encendido
4012248227732;Neuhaus Leuchten 6903- 55 - Deckenleuchte GU10 2x9W GX53 1x9W 6903- 55
4044018101942;Limburg Leuchten 6903 - Einbauleuchte QT12-ax 6903
5056097083766;Brand- X Sealed Bearing - 6903 RS Bearing - 6903 RS - Silver
5056097083872;Brand- X Sealed Bearing - 6903 2RS Bearing - 6903 2RS - Silver
5056097084541;Brand- X PLUS Sealed Bearing - 6903- V2RS Bearing - Silver - PLUS- 6903- V2RS
8719897602571;ProductsPro 2 stuks 18x30x7 18*30*7mm 6903/18 18307-2RS 18307 6903 RS MR18307-2RS Geen standaard voo
8719897605671;ProductsPro 20182 stks/partij 6903/18 18307-2rs 18307 6903 Rs Mr18307-2rs Geen Standaard Voor Fiets
6903683813506;Não encontrado
6905790003184;HPL Detector Luz Ultravioleta de Notas Falsas CNH e Cheques
6905790312316;Paris Irrigador Oral Bucal Portátil Sem Fio
6905790331010;That Girl Contador Manual Numérico 4 Dígitos Passos Pessoas Produtos
6905790511016;Não Informado Umidificador Purificador Aromatizador Carro Veicular Automotivo 12v - 51101
6905790512990;Wooden Clock Relógio de mesa digital data hora temperatura led sensor
6905790523217;Não encontrado
6905790530048;Não Informado Luminária 22 Leds
6905790531311;Não Informado Luminária com Espelho de Maquiagem LED
6905790532134;Não Informado Lupa Bifocal Dobrável de Mesa ou Mão 10 Leds MG3B- 1C
6905790532141;Não encontrado
6905790572512;Paris Lupa Portatil Com Iluminação Led De Mao Para Limpeza De Pele Medicina E Industria Dupla 3X 75M
6905790580050;Não Informado Umidificador de Ar Facial Portátil Recarregável Nano Azul
6905790581019;Não encontrado
6905792035954;WYJ Monóculo 35x95 Profissional Tático Luneta Telescópio
6905880800228;20 MW Universal KFZ-Halterung für Tablets bis 10.6 inch
6906179000022;Carregador Veicular Universal 2A 12V AL- PSA2AM Branco ALLTECH
6906596565463;Não encontrado
6907551014019;THATA Microfone de Mesa Condensador Mic com Tripé SF- 401
6907551014026;THATA Microfone de Mesa Condensador Mic com Tripé SF- 402
6907551014033;THATA Microfone Profissional de Mesa Condensador Mic com Tripé SF- 403
6908635035388;Artely Móveis Kit com 4 Cadeiras Facthus Preto Eiffel
6910069011401;Não encontrado
6911400355819;Avião Super Wings Change'Em Up 80064 Intek Dizzy
6911400357790;Super Wings Torre de Controle - Fun Divirta- se
6911400358155;Figura Super Wings Flip & Fly Jett 8279- 3 Fun Divirta- se
6911400363630;Fun Divirta- se Super Wings Torre de Decolagem do Jett Gigante 2 em 1 - Fun
6912345678902;20st blandade minifigurer (Passar Lego & liknande)
6912345678919;Dinosaurie Robot - Ljud & ljuseffekter - 400 mm
6913520223160;Não Informado Suporte Para Sombrinha e Flash Dedicado
6914098040067;Não encontrado
6914098073041;Não encontrado
6914103106948;Não encontrado
6914190002055;Não Informado Balança Eletrônica Digital para Bagagens 50Kg
6918009061912;Jpcell Kit Lanterna Led Holofote Mais Forte Que X900 Tatica, Faca
6918060806156;Não Informado Tábua De Carne Churrasco Bamboo Com Bandeja Gaveta 36x27
6918787622619;Máquina de Cortar Cabelo Homecut - Qirui
691991001802;Pedal para Guitarra Digitech Trio Plus - V 04, com Fonte Bivolt
6919910021200;Amplificador Crown Xls 1502 JBL
691991202902;Pedal de Efeitos Digitech The Drop Tune Pitch Shifter para Guitarra
6920074417112;Não encontrado
6920100008017;THATA Abajur Incandescente Aromatizador USB
6920170900501;Não encontrado
6920170900525;Não encontrado
6920170900921;Não encontrado
6920170901164;SO Brand New Women Classic Tow Bows Boot Black 3452 Original (7)
6920170901300;Extensor Elástico 1 Via Forte Storm Fitness Equipment Stormstrong
6920218905284;Luxcel Mochila Mala de Rodinhas Infantil Pucca Malinha Viagem Escolar Preta e Vermelha MIX8 845661
6920218905512;Mochila de Costas Romero Britto Verde 1 bolso Ref:. MS45209RB Luxcel
6920218971753;Não Informado Pasta Laptop Polo King Ex20041Pk - ÚNICO
6920218973016;Mala Polo King Abs Média 360 Detalhe Frontal Masculina
6920218973023;Mala Polo King Abs Tam.G 360 Detalhe Frontal
6920218973047;Mala de Viagem M 24 360º Las Vegas Luxcel MF10042PK 24 - Azul
6920218973054;Mala Polo King Abs Tam.G 360 Detalhe Frontal
6920218974006;Mala Polo King Abs Média 360 Detalhe Frontal Masculina
6920218974013;Mala Polo King Abs Tam.G 360 Detalhe Frontal
6920218975119;Frasqueira Luxcel Detalhe Frontal
6920218976413;Luxcel Mala 18 Polegadas Hot Wheels MF10059HW Preta
6920218976871;Mala Polo King Abs Bordo 360 Detalhe Frontal Masculina
6920218976949;Necessaire de Viagem Dobrável Luxcel NC14211PK - Rosa
6920218976956;Necessaire de Viagem Dobrável Luxcel NC14211PK - Preto
6920218976987;Necessaire Porta Sutiã e Lingerie Luxcel NC14213PK - Rosa
6920218979049;Mala Polo King EVA Cadeado TSA 360
6920218979070;Não encontrado
6920218979100;Não encontrado
6920218979582;Não encontrado
6920218993526;Não Informado Conjunto Kit 3 malas de viagem abs super leve polo king 360º
6920218999719;Malas de Viagem Luxcel MF10025LX Preta (P, M ,G)
6920243192406;Global Cortina 900 Leds Branco Quente 4m X 3m Decoração 110v
6920243892405;Global Cortina 900 Leds Branco Quente 4m X 3m Decoração 220v
6920303741056;Não Informado Ventilador De Coluna Ajustável Fort Home Fh- 630 3 Velocidades 43 cm 40w
6920303741063;Ventilador De Coluna Ajustável 40 Cm 3 Velocidades Fh630 220V Fort Home
6920303741070;Ventilador Umidificador Ionizador Portátil Acf5A Branco 127V Fort Home
6920303753196;Não Informado Chave De Roda Alongavel
6920303754667;Ventilador 3 Em 1 Profissional De Mesa Parede E Chão Completo Fort 80w
6920354822193;Creme Dental Colgate Natural Extracts Defesa Reforçada 90g
6920354822223;Creme Dental Colgate Natural Extracts Detox 90g
6920388171274;Piscina Infantil 350 Litros Redonda World Pool Rígida Jilong
6920388272063;Bóia Poltrona Inflável Piscina Lounge Morango com suporte para copos Jilong
6920388293891;Bomba De Ar com mecanismo para os pés Jilong
6920388472227;Kit Boia, Bola e Colchao Jilong
6920388600095;Fun Piscina Barbie 224 Litros
6920388606110;Boia Infantil Sunfit Baleia, Preta
6920388607209;Barbie - Praia Bola Fashion - Fun Divirta- se
6920388608282;Bote Inflável Barbie Fun Divirta- Se
6920388608473;Barbie - Praia Boia Glamourosa Pequena - Fun Divirta- se
6920388610803;Represent piscina inflavel beach 21l infantil bebe 90x60x13cm
6920388611480;Fun Piscina Barbie 744 Litros
6920388633253;Jilong Boia Colchão em formato abacaxi
6920388634335;Piscina Summer Hot Wheels 68 Litros - Fun Divirta- se
6920388634342;Piscina Hot Wheels 135 Litros Fun
6920388634366;Hot Wheels Bola Esporte - Fun Divirta- se
6920388634373;Hot Wheels Boia De Braço - Fun Divirta- se
6920388634403;8072- 9 Hotwheels - Colete Radical Fun
6920388767064;Fun Divirta- se Acessórios de Praia e Piscina - Colete Salva- Vidas Inflável - Barbie Glamurosa - Fu
6920388767071;Boia Inflável De Braço Infantil Fashion Barbie 7670- 7 Fun
6920388773096;Barbie Prancha De Surf Glamourosa Inflável Fun
6920388773102;Fun Divirta- Se Jet Ski Glamuroso Barbie Fun Divirta Se
6920388773119;Fun Divirta- Se Piscina Barbie 131 Litros Rosa
6920388970013;Piscina Inflável Infantil Sapinho Jilong
6920702730859;Bateria Samsung EB- BJ100CBE Galaxy J1 Original
6920840321063;Não encontrado
6920897700880;Não encontrado
6921027208085;LEMAT Aparador de Pelo Para Nariz e Orelha R.808
6921027208153;Sange Rifeng Navalha e Aparador Elétrico
6921027233896;Aparador de Barba RSCW 389 A - BIVOLT - Rifeng
6921027243895;Não Informado Máquina de Aparar Cortar Cabelo Barbeador Semi Profissional
6921027892161;Não encontrado
6921354160063;Não encontrado
6921497201333;MOTIVATE Guilhotina A3 Com Margeador Magnético - 12 Folhas
6921607104677;E- Blue Mouse Gamer USB 1600DPI Cobra type M
6921609160077;Não encontrado
6921703170101;Não encontrado
6921711402089;Sodo MH5 Over the Ear Wireless Headphone w/Speaker Mode - Silver
6921815605577;OnePlus 6 A6003 Dual-SIM (128GB Storage | 8GB RAM) (GSM Only, No CDMA) Factory Unlocked 4G Smartphon
6922119300052;Thata Esportes Medidor Monitor Automático de Pressão Arterial
6922345060164;Ombrelone com Haste Central Double Roof Azul FULL DELTA
6922345060317;Guarda Sol Articulado Verde 210 Cm Full delta
6922345060331;Guarda Sol Articulado Amarelo 210 Cm Full Delta
6923408923709;Monitor Gamer LED 27 AOC 144Hz 4ms Tela Curva Agon AG272FCX
6923408923716;Monitor Gamer LED 27 AOC 144Hz 4ms Tela Curva Agon AG272QCX
6923408923761;AOC Monitor Gamer LED 35 120Hz 4ms Tela Curva Agon AG352UCG
6923410712353;Philips Auriculares SHE2000 Preto
6923410713275;Fone de Ouvido Downtown SHL5600- 10 Philips
6923410713695;Ócio Philips She3590 Earphones
6923410716047;Fone de Ouvido com Alça Philips SHL3000BL/00 Estilo DJ - Azul
6923410722741;Marca Padrão Fone de Ouvido Philips SHL5305TL/00
6923410724868;Fone de Ouvido Bluetooth e Nfc Shb9150Bk/00 Philips
6923410725865;Philips Fone De Ouvido Estilo Dj Com Alça E Graves De Alto Impacto
6923410732160;Fone De Ouvido 107 dB 16 Ohm Graves Extras SHE3010PP Philips Lilás
6923410732399;Auscultadores Philips SH3060 - Preto
6923410732580;Auscultadores Philips SHL3060 - Branco
6923450555866;Fun Brinquedos Skate Barbie Com Acessórios de Segurança 7619- 1 Fun
6923520221684;Headphone PRETO com adaptador 6.3mm Edifier H850
6923520222155;Fone de Ouvido H185P Azul - Edifier
6923520222759;Fone de Ouvido K800 Camuflado - Edifier
6923520223046;Fone de Ouvido Bluetooth W670BT Edifier Branco
6923520224425;Fone de Ouvido Bluetooth EDIFIER W570BT Preto
6923520225217;Headphone Premium Bluetooth 4.1 e NFC Edifier - Cabo P2 removível, Microfone, Bateria com reprodução
6923520225231;Fone de Ouvido Headphone Edifier Hi- Fi W800BT Bluetooth Branco - Design Ergonômico, Couro Macio, Aj
6923520225798;Headphone Edifier com Bluetooth 4.1 e NFC - Bateria com duração de 95 horas com carga completa, Cabo
6923520225804;Fone de Ouvido Headphone Gamer Edifier G4 7.1 USB Branco - Cartão de Som Incorporado com Áudio 7.1
6923520225811;Fone de Ouvido Headphone Gamer Edifier G4 7.1 USB Preto/Vermelho - Cartão de Som Incorporado com Áud
6923520225828;Fone de Ouvido Headphone Gamer Edifier G4 7.1 USB Preto/Verde - Cartão de Som Incorporado com Áudio
6923520227976;Edifier W820BT Supra- aural Bandeau Rouge
6923520227983;Fone de ouvido Edifier Over- Ear W820BT Bluetooth - Unissex
6923520262823;Alto- falante Edifier para Notebook MP250 - Áudio, Vídeo, Preto/ Prata
6923520263455;Caixa de Som Edifier 2.1 Canais, 15W, Bivolt, Preto - X100B
6923520263769;Caixa de Som 27W RMS Edifier M1370B 2.1 Bivolt
6923520263882;Caixa de som Edifier 2.0 42W RMS Bivolt R1280T
6923520264056;Caixa de som Edifier 2.0 24W RMS Bivolt R1000T4 MADEIRA
6923520264063;Caixa de som 2.0 Edifier 24W RMS Bivolt R1000T4 Preto
6923520264346;Caixa de Som Bluetooth para Studio 78W RMS Edifier R2000DB
6923520264599;Edifier Caixa Portatil Com Funcao Bluetoofh Mp- 233 Branca 9w
6923520264759;Caixa de som para PC EDIFIER R12U - Preta
6923520264803;Caixa de som para PC EDIFIER R12U - Branca
6923520264827;Caixa de som para PC EDIFIER R12U - Vermelha
6923520264834;Caixa de Som com FM, USB e cartão SD EDIFIER XM2PF 21W RMS Bivolt
6923520265794;Caixa de Som Edifier 24W R1010BT Preto - 2 entradas RCA, Controle de Volume, Graves e Agudos, Config
6923520265855;Monitor de Refer?ncia Bluetooth Edifier R1700BT Preto (Par)
6923520265923;Caixa De Som Edifier R1850DB Preta Monitor Referência Home Studio Bluetooth
6923561500731;Não encontrado
6924309021785;Pincel Reservatório Sinoart Water Brush 003 Un SFB 0244
6924309030275;Aquarela em Pastilha Sinoart18 Cores com Pincel
6924309072565;Borracha Elétrica para Desenho Sinoart com 06 Refis
6924328302544;Serra Circular 4.3/8 POL 400W WORX
6924466300419;Mochila Princess
6924466300754;Lancheira Luxcel Superman Infantil
6924466303038;Estojo de tecido Superman Gd 2 ziperes Azul Luxcel
6924466304141;Não Informado Mochila Esportiva p/ Notebook com Carrinho Polo King Preta - EC21016PK
6924466307111;Não encontrado
6924466307159;Mochila Infantil Hummer Amarelo GM Luxcel LA32443HM
6924466307319;Não encontrado
6924466307456;Luxcel Estojo Duplo Moranguinho Baby Rosa Infantil Original Meninas
6924466307487;Não Informado Lancheira Cindy La32083Cd - B
6924466307715;Lancheira Térmica Penelope Charmosa Luxcel LA32173PE (146845)
6924466307852;Lancheira Térmica Moranguinho Brilhante Original Luxcel
6924466308286;Mochila de Rodinhas Luxcel Super Man Preta
6924466308378;Mochila de Rodinhas Luxcel Super Man Azul
6924466309009;Lancheira Térmica Luxcel Disney Pluto
6924466309023;Mochila Infantil Luxcel Superman
6924466312368;Mala Luxcel Mala Infantil Batman 18 Preta/Amarela
6924466390250;Mala Luxcel Infantil Minnie Mouse 19 Preta/Vermelha
6924466390311;Luxcel Malinha Infantil 4 rodas Mickey Mouse Unissex
6924466391479;Malinha Grande Minnie Mouse MF10121MI - Luxcel
6924466397945;Não encontrado
6924466398324;Mala de Viagem G 28 360º Las Vegas Luxcel MF10042PK 28
6924466398331;Mala de Viagem M 24 360º Las Vegas Luxcel MF10042PK 24
6924466398980;Não Informado Conjunto Kit 3 malas de viagem abs super leve polo king 360º
6924781201217;Limpador Magnético Boyu B 1021
6924781202221;Boyu Pinza Plantas Plastico 150 Gr
6924781203389;Não Informado Filtro Submerso Com Bomba JAD SP- 1800I 700L/H 110V
6924781207080;Não Informado Carvão Ativado JAD C- 150B 150g
6924781210028;Bomba Compressora Boyu Para Aquários SC- 3500
6924781211094;Boyu Bomba submersa SP- 500 220v
6924781233034;Boyu Tijeras Plantas Metalica 300 Gr
6924781245587;Refil Boyu para Filtro Externo WF- 2015
6924871801761;Uatt Conjunto Porta Retratos 3 Círculos Laranja
6924871803635;Uatt Tulipa Térmica Sempre Cheia
6924871807671;Uatt Relógio De Parede Tic Tac
6924871808913;Squeeze Halter Uatt?
6924871809750;Canecão térmico uatt? plástico e gel 450ml
6924871822520;Fronha Unicórnio Uatt - Lilás
6924871827624;Porta Retrato De Vidro 10x15 Arrasa Uatt - Pink
6924871827969;Garrafa Térmica 500 ml com Caneca Deseja Uatt - Azul
6924871829352;Garrafa Spray #Projetodiva Uatt
6924871829697;uatt Almofada de Pipoca - Luz, Câmera, Ação
6924871830259;Garrafa Infusor Easy 500ml Unicórnio Uatt - Roxo
6924871832291;IDEIAS Caneco de Cerveja 380 ml com Sineta Flamengo
6924871834837;Não encontrado
6924871835346;uatt? Almofada 30x40 Chic Uatt - Azul Marinho
6924871851254;Uatt Porta Retrato 10x12 - Mãe, amor sem medidas
6924871851339;Uatt Marmita Térmica Inox - Muito Amor
6924871855764;Uatt Almofada de Pescoço Shape - Gatinha
6925187800653;Não Informado Pasta Executiva Com Rodas Polo King Ec21021Pk
6925187800721;Mala Polo King Ipanema
6925187800738;Luxcel Mala Polo King Ipanema Média
6925187800745;Mala de Viagem Polo King
6925187800820;Luxcel Mala Polo King Ipanema Média
6925187800844;Mala Polo King Ipanema
6925187800851;Luxcel Mala Polo King Ipanema Média
6925187800868;Mala de Viagem Polo King
6925187801322;Não encontrado
6925187801339;Não encontrado
6925187801377;Não encontrado
6925187801827;Não Informado Mala De Bordo Polo King Jade - Preto
6925187801841;Não encontrado
6925187849768;Mala de Viagem Luxcel MF
6925187863931;Não Informado Mala Infantil Minnie
6925187866574;Mochilete Ever After High, Pink, M - MF1012EA- 18 - Luxcel
6925187868189;Luxcel Mochila Infantil Petit Passarinho Feminina
6925187868578;Não Informado Mochila Infantil Masha e o Urso Plush Pequena - Masha
6925187868646;Lancheira Masha E O Urso Luxcel Feminina
6925187869261;Mochilete Escolar Pequena Pets Hero Azul - Luxcel
6925187869278;Lancheira Escolar Pets Hero Azul - Luxcel
6925187869858;Lancheira Aracni - Luxcel
6925187871257;Não encontrado
6925187875989;Não encontrado
6925187876672;Não Informado Mochila De Costas Up4you By Larissa Manoela Jeans Claro
6925187876689;Não Informado Mochila De Costas Up4you By Larissa Manoela Jeans Escuro
6925187880075;Não encontrado
6925187882949;Mochila Harry Potter Símbolos Azul - Luxcel Ms45643hp
6925187886848;Não Informado Mochilete Juvenil De Estrela - Larissa Manoela
6925187892078;Mochila Harry Potter Preto - Luxcel
6925187894317;Não encontrado
6925263631805;Ns Bao Lanterna luminário led mini lampião sinalizador recarregavel portatil nsbao yg- 3870
6925263634943;Lanterna Recarregável 1 Led Nsbao 110V e 220V
6925263634981;Mata insetos elétrico verde bivolt - NY5611 - Nsbao (110V/220V)
6925263636763;Nsbao Armadilha Mata Mosquitos Zika Dengue Pernilongos E Insetos Por Luz E Sucção Luminaria Repelent
6925263637036;Nsbao Armadilha Mata Mosquitos Zika Dengue Pernilongos E Insetos Por Sucção Luminaria Repelente Elet
