630509321384;Kit DohVinci Vaso de Folres com Acessórios B2834 - Hasbro
630509321971;Boneco Transformers 4 Steps B2238 Hasbro Optimus Prime
630509322909;Hasbro B0368 My Little Pony Fig 20 Cm Princesa Cadance
630509323258;Lançador NERF STAR WARS Stormtrooper Hasbro B3171
630509324873;Conjunto Hasbro Playdoh Marvel Pote- Veículo
630509324897;Conjunto Massinha Play- doh Festa Da Pizza Hasbro
630509324910;Play Doh Corrida De Minions Massinha Modelar Hasbro
630509324934;Massinha de Modelar Play Doh Laboratório Maluco Minion Hasbro
630509324972;Mini Balde Massa de Modelar Hasbro Play Doh 4 Potes Moldes Números
630509331697;Hasbro Espada Star Wars Sabre De Luz Eletrônico Jedi Master Ep Vii
630509332311;Veículo Star Wars Galaxy Heroes Millenium Hasbro
630509332410;Boneco Star Wars - Playskool - Darth Vader e Stormtrooper - Hasbro
630509336241;Nave Millenium Falcon Falcão Milenar Star Wars Episódio VII Hasbro
630509339983;Lançador de Água Nerf Rebelle SuperSoaker Tidal Twist B4034 - Hasbro
630509340026;BABY ALIVE- SUPER SNACKS DA COMILONA Hora do Lanche B1452 HASBRO B1451
630509346691;Star Wars Ep Vii Sabre Kylo Ren Force Fx Deluxe Black Series Hasbro B3925
630509346776;Hasbro Veículo VClass III Star Wars Ep VII
630509347087;Hasbro Máscara Eletrônica Star Wars Vilão Kylo Ren Ep Vii
630509347124;Hasbro Veículo Class II Delux Habsro
630509350216;Boneca Descendantes Disney Lonnie Auradon Prep B3118 Hasbro
630509359080;Kit 4 Mini Potes de Massinha Play- Doh Hasbro 23241
630509359172;Boneco Marvel Legends Infinite Series - Build a Figure - Ant- Man - Homem- Formiga - Hasbro
630509360598;Lança Dardo Nerf Modulus Ionfire Hasbro
630509360666;Brinquedo Lancador Nerf Dual Strike Elite Hasbro B4620
630509360680;Lança Dardo Nerf Modulus Recon Hasbro
630509360994;Nerf Lançador de Água Super Soaker H2o Ps Squall Surge Hasbro
630509361243;Não encontrado
630509363698;Boneco Star Wars Episódio VII 30 cm Darth Vader Hasbro
630509363858;Hasbro Figura Star Wars Assault Walker Marcheur DAssault StromTrooper e Robo Carro B3919
630509363957;Boneco Finn Jakku Star Wars Episódio VII Black Series Hasbro
630509364138;Boneco Stars Wars Boba Fett Hasbro B3667
630509364336;Figura dupla 3.75 star wars epvii sort hasbro
630509364527;Hasbro Conjunto Star Wars Personagem Han Solo & Taun
630509365036;Hasbro Veículo Classe I Star Wars Moto Speeder Délite B3716
630509365258;Espada Star Wars Sabre Básico Luke Skywalker Episódio 7 Hasbro
630509365869;Conjunto Play- Doh Balde de Atividades B1157 - Hasbro
630509373260;Hasbro B3929 Starwars Veículos Bs Diecast Tie Advanced
630509376742;Lançador de Água Nerf Super Soaker Breach Blast B4438 - Hasbro
630509382293;Hasbro Sabre Luz Star Wars B4848
630509389605;Hasbro Lança Dardo Homem De Ferro B5785 Colorido
630509390311;Coleção Amigos Frozen Hasbro B5198
630509390809;Boneco Articulado Avengers Titan Hero Pantera Negra B6154 - Hasbro
630509390953;Conjunto Disney Frozen Playset Luxo O Castelo De Gelo Da Elsa Hasbro
630509392605;Nerf Rebelle Super Soaker Cascade - Hasbro
630509393930;Hasbro Boneca Clássica Princesa Aurora
630509398553;Caixa de Ferramentas Playskool Hasbro
630509406265;HASBRO11545 My Little Equestria g Min Cenário Bás Beleza Hasbro
630509409655;Playskool heroes marvel super hero adventures - homem aranha na selva b5403
630509409945;Hasbro Conjunto marvel super hero adventures - homem- aranha & octo- mech b5409
630509410835;Boneco Transformers Rescue Bots Pets Servo Hasbro B4955
630509411535;Hasbro B4963 Transformers Playskool Rescue Bots Bombeiros
630509412433;HASBRO 11446 Jogo Jenga Frozen Hasbro
630509412716;Boneca Princesas Disney Bolinhas De Sabão Ariel B5303 Hasbro
630509412846;Hasbro B5309 Disney Princesas Penteadeira Encantada Da Cinderela
630509413416;Hasbro Boneco Figuras Marvel Legends Red Guardian
630509414628;Conjunto Play Doh Tortas Divertidas Hasbro B3398
630509414741;Hasbro Massinha Play Doh 4 Potes Sortido B5517 Colorido
630509417117;HASBRO 11682 Play Dohvinci Kit Top Platinum Hasbro
630509417438;HASBRO 11680 Play Doh Vinci Refil Decopop Brilho Hasbro
630509418107;PLAY DOH Vinci Penteadeira Frozen Hasbro B5512 11687
630509418268;My Little Pony Guardians of Harmony Fan Series Discord Figure
630509421657;Star Wars - R/C e lança dardos Rogue One Rapid Fire Imperial - Hasbro B7076
630509423699;Conjunto Play Doh Town Mini Veículo Sort Hasbro B5976
630509424092;HASBRO 11532 Playskool Tranformers Rescue Bots Figura R. Bots Megabot Sort Hasbro
630509424160;Hasbro Marvel Super Hero Adventures Mega- Armadura Homem Aranha B6019
630509424399;HASBRO 11710 Avengers Figura Titan Marvels Falcon Hasbro
630509424535;Cenário Spider Man Web City Showdown Hasbro
630509424696;Playset Marvel Spider Man Rhino Ataca Hasbro
630509425563;Hasbro Playset Littlest Pet Shop Pista de Skate
630509427420;Hasbro Conjunto Mini Castelo Temático Cinderela
630509427956;Hasbro Nerf Doomlands 2169 Persuader B4950
630509428205;Marvel Legend Series Figura CAPTAIN AMERICA Hasbro B7433
630509428335;Marvel Legend Series Figura IRON MAN Hasbro B7434
630509428526;Não encontrado
630509430055;Conjunto PlayDoh Hasbro Castelo Da Elsa
630509437269;Massinha Play- Doh Marvel Vingadores Heróis Reunidos
630509440399;Trolls Conjunto Town Coroação Hasbro
630509444489;Play- Doh Conjunto Play Doh DohVinci Caixa de Jóias Hasbro
630509447046;Hasbro B7439 Marvel Legends 6' Avengers Dr Strange - Kit Completo
630509447251;Brinquedo Lança Dardos Nerf Doomlands Longarm B8099 Hasbro
630509450664;Hasbro Nerf Star Wars Rogue One Sergeant Jyn Erso
630509450701;Lançador Nerf Eletronico Star Wars Rogue One Imperial Death Trooper Hasbro B7765 11950
630509454778;Hasbro Comjunto Play Doh Brincadeira de Dentista 60 Anos B5520
630509457519;Não encontrado
630509457649;Boneco Yo- kai Watch Jibanyan Transformavel + Medalha Hasbro
630509461424;Transformers Blurr B7026/B7762 Hasbro
630509461592;Hasbro Transformers Generations Titans Return Autobot Infinitus & Sentinel Prime B6459
630509464203;Baby Alive Borboletinha Loira Hasbro
630509465934;Boneca Princesa Ariel Disney B5279 - Hasbro
630509466009;Boneca Princesa Bela Disney B5281 - Hasbro
630509466047;Boneca Princesa Cinderela Disney Hasbro B5899 11503
630509469277;Refil Dardos Star Wars Rogue One Hasbro
630509492077;Conjunto Homem Aranha Herói Hasbro
630509492923;Playskool Sr. Cabeça de Batata Maleta do Mr.Potato- Aranha
630509493326;Conjunto Boneco Homem Aranha Deluxe Hasbro
630509494828;Playset Flip Racers Optmus Prime ao Resgate - Hasbro
630509496273;Hasbro Figura Guardiões Da Galáxia Groot Crescendo
630509498628;Lançador Supergrip Beyblade Burst - Hasbro
630509503971;Hasbro B6321 Nerf Modulus Acessório Gear Apoiador De Armazenamento
630509511037;Conjunto Play Doh Town Escavadora - Hasbro
630509519286;Sabre de Luz Básico Star Wars Vilão - Hasbro
630509519361;Boneco Star Wars O Último Jedi Bb- 8 - Hasbro C1438
630509519552;Hasbro C0212 Transformers Playskool Boulder Resgate Ártico
630509519866;Não encontrado
630509523436;Pinkie Pie Com Cauda Motorizada - Hasbro
630509524822;Massinha Play- Doh My Little Pony Pinkie Pie Festa de Cupcakes
630509524914;Massinha Play- Doh Homem Aranha Contra Doc Ock
630509525249;Bastão Extensível Star Wars - Hasbro
630509525744;Play- Doh - Conjunto Rolos, Cortadores e Mais - Hasbro
630509527106;Martelo Do Trovão com Som Thor Ragnarok - Hasbro B9975
630509527465;Conjunto My Little Pony Mundo Marinho - Hasbro
630509529902;Conjunto My Little Pony Castelo Mágico - Hasbro
630509530090;Death Trooper Nerf Luxo Star Wars Disney - Hasbro C1605
630509530113;Refil Nerf Star Wars - Hasbro C1607
630509530137;Boneco Star Wars O Último Jedi BB- 8 - Hasbro C1438
630509530175;Nerf Star Wars Episódio VIII Tango Leader - Hasbro
630509531776;Boneco Homem de Ferro Iron Man Avengers 15cm - Hasbro B9939/C0649
630509533633;Lançador NERF Accustrike Falconfire Hasbro B9840 12260
630509534524;Conjunto Play- Doh Cabelo Maluco B3424 Hasbro
630509535101;Hasbro B9486 Beyblade Burst Lançador Com Pião Doomscizor D2
630509535248;Não encontrado
630509535477;Conjunto Beyblade Duelos Épicos - Hasbro
630509537358;Hasbro Transformers Mv5 Step Turbo Optimus Prime C1312
630509537372;Hasbro Transformers Mv5 Knight Armor Optimus Prime C1317
630509537419;Hasbro Transformers Mv5 Legion Optimus Prime C1326
630509538799;Hasbro Transformers - Boneco Robots In Disguise Combiner Force - Primestrong C0629
630509539741;Hasbro Boneco Homem Aranha 15cm - Clássico B9990
630509540990;Massinha Play- Doh Fábrica de Macarrão
630509541010;Massinha Play- Doh Criações No Fogão
630509541034;Play DOH Mesa Criativa Hasbro 12350
630509541287;Conjunto DohVinci Styler para Iniciante Hasbro
630509541379;Conjunto Play Doh Star Wars R2- D2 e BB- 8 - Hasbro
630509541577;My Little Pony - Desfile Na Passarela - Princess Twilight Sparkle B9623
630509541591;My Little Pony Bolsinha de Passeio Princess Twilight Sparkle B9828
630509541638;My Little Pony Cabelos Estilosos Applejack B9617
630509541652;My Little Pony Amizades da Realeza Princess Twlight Sparkle & Applejack B9850
630509542369;Playskool Transformers Rescue BOTS Bumblebee Cavaleiro Vigilante Hasbro C1122 12223
630509542611;Sabre de Luz Star Wars Cavaleiro Jedi Ep 8 - Hasbro
630509542741;Littlest Pet Shop Dupla Arco- Íris Apricotta Ambergleam & Sunset Glimmerbug C0799
630509542796;Não encontrado
630509545056;Não encontrado
630509545421;Play Doh Estúdio De Arte Doh Vince - Hasbro
630509545445;Play Doh My Little Pony Tesouros Da Amizade - Hasbro
630509545469;Não encontrado
630509548453;Littlest Pet Shop Dupla Série 1 - Frilly Lepapillon & Pitley Bullbury C3008
630509548514;Não encontrado
630509553549;Não encontrado
630509556236;Café da Manhã Play- Doh - Hasbro B9739
630509556960;Moda Divertida My Little Pony Play Doh - Hasbro B9717
630509557653;Conjunto de Massinha Hasbro Play- Doh Carros Mcqueen
630509561704;Hasbro Baby Alive - Fraldas Para Boneca C2723
630509561759;Boneco Eletrônico Homem Aranha Abutre Hasbro
630509564422;Sabre de Luz Eletrônico Star Wars Feature - Hasbro
630509569083;Conjunto Homem Aranha com 3 Bonecos - Hasbro
630509582136;Star Wars E8 Tango White Figure
630509589760;Hasbro Transformers Mv5 Robot Earth Autobot Sqweeks com Controle Remoto C0935
630509592456;Transformers O Último Cavaleiro Step Turbo Changers Dragonstorm - Hasbro
630509597215;Conjunto de Tesouros com Anel Hanazuki - Hasbro
630509608539;Conjunto de Massinha Hasbro Play- Doh Moldar a Vida
630509608942;Outras Marcas Lançador Nerf Vingadores Guerra Infinita Hulk - Hasbro
630509608973;Outras Marcas Lançador Nerf Vingadores Guerra Infinita Capitão América - Hasbro
630509609017;Nerf Ssoaker Zombie Ripstorm Hasbro E0020
630509611232;Lançador NERF Super Soaker Splashmouth Hasbro 13065
630509611447;Hasbro Marvel Legends Avengers Infinity War Punho Thanos Articulado
630509611614;Nerf Accustrike Quadrant Hasbro 13030
630509612437;Boneco Articulado - 30 Cm - Disney - Marvel - Spider- Man - Hasbro
630509616886;Máscara Homem Formiga Multi Lentes - Hasbro
630509616909;Garra Basica Avengers Pantera Negra Hasbro E0873 12961
630509618415;Lançador de Dardos Nerf Accustrike Firestrike - Hasbro
630509626663;Baby Alive Refil Comida em PO Hasbro E0302 13203
630509636709;Outras Marcas Lançador Nerf Vingadores Guerra Infinita Homem de Ferro - Hasbro
630509643240;Star Wars Lançador Athena - Hasbro
630509644131;Boneco de Ação com Joia - 20 Cm - Disney - Marvel - Avengers - Guerra Infinita - Capitão América - H
630509645862;Não encontrado
630509647576;Não encontrado
630509648214;Star Wars Lançador Zeus - Hasbro
630509651283;Boneco Transformável - 19 Cm - Playskool - Disney - Marvel - Mr. Potato Head - Iron Man - Hasbro
630509653485;Manopla do Infinito Eletrônica - Hasbro
630509653683;Veículo e Figura - Playskool Heroes - Disney - Marvel - Capitão América - Carro Lançador - Hasbro
630509655519;Arena Chaos Beystadium - Beyblade - Hasbro
630509656783;Boneco Articulado - 30 Cm - Titan Heroes - Disney - Marvel - Spider- Man - Kid Arachinid - Hasbro
630509656950;Figura de Ação - 30 Cm - Disney - Marvel - Titan Hero Series - Pantera - Hasbro
630509658695;Pião Beyblade Sstrike - Roktavor R3 - Hasbro
630509659333;Arena de Batalha - Beyblade - Set de Batalha Star Storm - Hasbro
630509660421;Playskool AeroGancho Chomp Squad - Hasbro E1455
630509660445;Não encontrado
630509660476;Playskool Heroes - Dinossauro Chomp Squad Trailer - Agente Cela E0967
630509671267;Nerf Lançador de Dardos N- Strike Elite Delta Trooper - Hasbro
630509671380;Lançador Nerf - N- Strike Mega - Thunderhawk - Hasbro
630509672790;Refil BABY Alive Comidinha Massinhas Hasbro C2727 12165
630509680795;Nerf Lançador Modulos Ghost Ops Eveder - Hasbro
630509691258;Wizkids Star Trek: Galactic Enterprises Board Game
630509691272;Nerf Laser Ops Pro Alphapoint
630509691296;Hasbro Nerf Laser Ops Burst Fire Combat Blaster
630509702572;Massa de Modelar - Play- Doh - Kitchen Creations - Super Máquina de Sorvete - Hasbro
630509705153;Nerf Lançador Modulos Ghost Ops Chronobarrel - Hasbro
630509711116;Homem Aranha Lança Dardos Vingadores Guerra Infinita - Hasbro
630509714964;Play Doh Supermercado Divertido - Hasbro
630509721573;Boneco Avengers Titan Deadpool Hasbro E2933 13007
630509724956;Não encontrado
630509726325;Hasbro Massinha Play- Doh - Kit de Construção
630509734320;Figura Colecionável - 30cm - Disney - Star Wars - O Despertar da Força - BB- 8 - Hasbro
630509734337;Figura Colecionável - 30cm - Disney - Star Wars - O Despertar da Força - R2- D2 - Hasbro
630509752836;Não encontrado
630509757930;Não encontrado
630509759255;Não encontrado
630509760343;Não encontrado
630509761043;Não encontrado
630509764013;Não encontrado
630509769155;Não encontrado
630509771417;Não encontrado
630509778713;Não encontrado
630509797134;Não encontrado
630509797158;Não encontrado
630509797240;Não encontrado
630509825790;Não encontrado
630509863938;Não encontrado
630509863952;Não encontrado
630996120170;Glitzi Globes Megadome Castelo de Princesa Intek
6311330217438;Não Informado Relógio Smartwatch Android A1
631312801353;Beats Creature Creatine Complex Suplemento alimentar que auxilia em exercícios físicos intensos e at
631656604696;Platinum BCAA 8:1:1 - 200 Tabletes - Muscletech
631656705010;Muscletech Platinum 100% Whey Milk Chocolate Supreme
631656710465;Nitro Tech 100 Whey Gold Cada porção fornece 24g de Proteína + 5 5g de BCAA + 4g de Glutamina Solúve
631656710748;Nitro Tech 100 Whey Gold Cada porção fornece 24g de Proteína + 5 5g de BCAA + 4g de Glutamina Solúve
631656710755;Nitrotech 100 Whey Gold 454 gr refil MuscleTech
633356415848;We R Memory Keepers NOTM459272 - Eyelets Standard 60/Pkg
633356422181;We R Memory Keepers NOTM031014 - Eyelets & Washers Standard
633356607779;Furador Tag WER019 Três Tamanhos Diy Party Tag Punch
633356631347;Alicate Aplicador De Ilhós Crop A Dile We R Memory Keepers
633356709381;W/18 RULR-MAGNETIC MAT 16X20
633951900022;Cartucho HP 60XL Black Original
6342004865235;Não Informado Tabuleiro Dobrável 2 em 1 Xadrez e Dama Peças Magnéticas
634482160497;Action figure Bret Hart The Simpsons 25th Anniversary Series 3 Neca
634482160558;Action figure Teller The Simpsons 25th Anniversary Series 3 Neca
635464420097;Hercules GS422B Double Guitar Stand
6358400765536;Fun Divirta- Se Patinete Dobrável Fun Girls
6359660807073;Money Detector Teste De Cédula Nota Falsa Detector Uv De Notas Falsas
6359660807325;YDH Massageador Elétrico Corporal Infravermelho Top 220v ou 110v
6359660826951;Não encontrado
6362571015758;Não encontrado
6362571019022;Não encontrado
637285222096;Importado HD Interno 500GB para Xbox 360 Slim
639853916109;Não encontrado
641300145475;Pedal Crank Brothers Egg Beater Candy 1 MTB Clipless de Encaixe - Preto
641378035395;Não encontrado
641489934181;Outras Marcas Boneco Batman - Edimagic
6417084204127;Gps e navegadores Suunto Spartan Trainer Wrist Hr
642611003300;Oxford ROK 12mm Straps Green One Size
6434505925188;Intelbras Aparelho Telefone Fixo Bina ID de Mesa Casa Consultorio Loja
6438158567214;Smartphone Nokia Lumia 720 Desbloqueado Branco, Windows Phone 8, Tela 4.3, NFC, Wi- Fi, 3G, GPS, Câm
6438158635005;Nokia Asha 501 Dual Chip Branco, Câmera 3.2MP, Rádio FM, MP3, Bluetooth, Wi- Fi e Acesso a Redes Soc
6438158658585;Nokia Lumia 630 Branco, Dual Chip, TV Digital, Processador Quad Core 1.2GHz, Windows Phone 8.1, Tela
6438158680708;Nokia Lumia 635 4G 8GB tela 4 5' câm 5mp Verde
6438158716841;Smartphone Microsoft Lumia 435 Branco, Dual Chip, Tela 4, Windows Phone 8.1, TV Digital, Processador
6438158719224;Smartphone Microsoft Lumia 640 XL Preto Dual Chip Windows Phone 8.1 Wi- Fi Tela de 5.7 Câmera 13 Meg
6438158722361;Nokia Celular Microsoft Lumia 430 Dual 3G Chip 8GB tela 4' Preto
6438409024800;Nokia 106 Dual Sim Zwart (Engelstalig)
644225722837;Power Crunch 40g - BNRG
6459751458518;Bastão para Selfie MonoPod com Controle Bluetooth para Android e iOS
646511007000;Gaspari Nutrition BCAA 6000 180 tabs
649528762191;Crucial Memória RAM SODIMM 4GB DDR3- 1600 (CT51264BF160BJ)
649528774248;CRUCIAL Memoria Ballistix Sport Lt White Desk 8gb Ddr4 2400mhz Bls8g4d240fsc
649528776389;8GB DDR4 2400Mhz Crucial - CL17 - CT8G4DFS824A
649528778314;Alfatec Ssd 1tb M2 Pci- e Crucial
649528787330;Crucial BX500 - 480 GB
649674029414;Bronzeador RK by Kiss NY All Over Glow Powder Dourado 9g
649674029445;Bronzeador RK by Kiss NY All Over Glow Powder Dourado 9g Incolor
649869551683;Norscot Mini carregadeira 297c Caterpillar 1:32
6499336012346;Não encontrado
650240004032;Gel para Banho Ducha Esfoliante Asepxia 250g
650240018725;Esfoliante Profundo para Rosto Asepxia 150ml
650240031328;Gel Redutor de Medidas Siluet 40 Genomma 200ml
650590196357;MICRON Pen Drive Usb 3.0 - S45 - 64Gb - Turquesa - Lexar
6506079625822;Não Informado Dado Almofada Pelúcia Com Chocalho Infantil Educativo
6506079633230;Não encontrado
6514119678394;Não encontrado
652418108139;Kit Viagem NPPE Sh Rd Nutra Therapy 480ml
653463456;Não foi possível retornar o EAN do produto
653569188124;Massinha Play- Doh Ferramentas Dial'n Stamper Hasbro
653569692935;Hasbro 37366 Play Doh Playset Brinc Dentista
653569833994;Jogo Infantil Jenga Clássico A2120 Hasbro
653569955337;Bey Blade Pião Beywarrior Pack com 02 Hasbro
6549669633845;12pcs Gel Pen Black Ink Roller Marker Pen(Assorted Colors Cactus Potting Styling)
65541381346;Não foi possível retornar o EAN do produto
657440025089;1/18 1981 Checker A11 Chelsea Fire
6593678941538;Fun Metralhadora de Dardos Max Steel
660685141131;Used Canon XC10 Camcorder Video Camera, Excellent Condition
661732731473;Miniatura Pagani Zonda C12 1/18 Motormax Vermelho
661732732357;"Frost ""DAD A Son's First Hero"" 1956 Ford F-100 Truck and Red Smooth Bone Peanut Set"
661732733262;Miniatura Ford Maverick 1974 1/24 Motormax Azul
661732733552;MOTORMAX Chevy C10 Fleetside (1966) Model Toy Car
661732733651;MOTORMAX 73365w Lamborghini Concept S White 1-24 Diecast Car Model
661732733729;MOTORMAX 73372r Alfa Romeo 159 SW Red 1-24 Diecast Car Model
661732793150;MOTORMAX 79315bk 1969 Ford F-100 Pickup Truck Black 1-24 Diecast Model
661732793471;Blue 1970 Chevy El Camino SS 396 1/24 Scale Diecast Model
661732795086;Motormax Toy 79508 1 isto 24 McLaren P1 Diecast Model Car, Matt Blue
662248915685;Jogo para PS4 Final Fantasy XIV Heavensward Square Enix
662248916347;Não encontrado
662248918440;Jogo para PS4 Simulador de Motocross MXGP2 Square Enix
663296421005;Joystick Thrustmaster T- Flight Hotas One Standard - Xbox One/ PC
0022697664648;ATTWOOD MARINE 66464- 7 Big Game Series Rod Holder - 0 Degree - Black Insert
0732611664646;Hedman Hedders 66464 Htc Hedders Exhaust Header
4020841651489;66464 Belden Verbindungsleitung 20m 0985 342 100/20 M
4021499664647;LG 66464, Akku, passend für Lg electronic F800L
4988006835061;Boz Scaggs Fade Into Light II 2005 Japanese 2-disc CD/DVD set TOCP-66464
0000025085013;Nunwhore Commando 666 - Nunwhore Commando 666
0044001911118;666, Rhythm Takes Control (666 In The Mix)
0602498259870;666, Policia! (666 Alerta! Screen Cut)
0666496425422;666: Double Dose of Maiden / Various - 666: Double Dose of Maiden
0720264321689;Megadyne Zahnriemen 100 - S3M - 666 - 222 Zähne - 3 mm Teilung - 666 mm - 10 mm Breit
0720264321696;Megadyne Zahnriemen 150 - S3M - 666 - 222 Zähne - 3 mm Teilung - 666 mm - 15 mm Breit
0741157056624;666: Number One Beast 1: Tribute to Iron Maiden - Vol. 1- 666- Number of the Beast
0741157090925;Iron Maiden Tribute: 666 Number One Beast 2 / Var - Vol. 2-666-Number of the Beast
0751707077719;MOTHERFUCKER 666 OLD SCHOOL PUNKS W/MEMBERS FROM ANGRY SAMOANS, LAZY COW. MOTHERFUCKER 666, Vinyl LP
0751707077726;MOTHERFUCKER 666 OLD SCHOOL PUNKS W/MEMBERS FROM ANGRY SAMOANS, LAZY COW. MOTHERFUCKER 666, CD
0759718515817;Davila 666, Davila 666
0867574000191;11,666,666,666,666,666,666 - Mukqs
0884501031196;Creepsvile 666, Creepsville 666
1111530586076;Power Stop 16-666 Z16 Evolution Scorched Brake Pads 16-666
1111530618418;Power Stop Z23-666 Z23 Evolution Sport Brake Pads Z23-666
4000896206841;Hazet 666- 7 Airco- installaties ventiel bit 666- 7
4003625066600;Ersatz-Pfefferstreuer für Menage Sets 666 (Set of 3) 666/902
4003625066617;Ersatz-Salzstreuer für Menage Sets 666 (Set of 3) 666/901
4003625964241;Ersatz-Maggiflasche für Menage Sets 666 666/904
4003625964456;Ersatz-Sojaflasche für Menage Set 666/005 666/905
4003625965408;Senflöffel für Menage Sets 666 666/100
4003625971706;Ersatz-Senftöpfchen für Menage Sets 666 666/903
4007841003777;Steinel L 666 LED - Wall luminaire 1x8W LED - L 666 LED
4007841006211;Steinel EG L 665/L 666 LED - Ersatzglas EG L 665/L 666 LED
4007841053116;Steinel L 666 LED ANT V2 - Ceiling- /wall luminaire L 666 LED ANT V2
4011333106662;HaWe 10.666 MAGNET-STECKSCHLÜSSEL-EINSATZ 1/4 Z 4011333106662-HaWe.10.666
4011333426661;HaWe 42.666 BAUSCHLÜSSEL MIT MESS-SKALA 4011333426661-HaWe.42.666
4011333666081;HaWe 666.08 GIPSERHANDSCHUH POWER GRIP GR 8 4011333666081-HaWe.666.08
4011333666098;HaWe 666.09 GIPSERHANDSCHUH POWER GRIP GR 9 4011333666098-HaWe.666.09
4011333666104;HaWe 666.10 GIPSERHANDSCHUH POWER GRIP GR 10 4011333666104-HaWe.666.10
4011333666111;HaWe 666.11 GIPSERHANDSCHUH POWER GRIP GR 11 4011333666111-HaWe.666.11
4017332059404;WAGO Kontakttechnik 209-666/000-006 (5 Stück) - Label for terminal block blue 209-666/000-006
4017332059411;WAGO Kontakttechnik 209-666/000-005 (5 Stück) - Label for terminal block red - 209-666/000-005
4017332273442;WAGO Kontakttechnik 209-666 (5 Stück) - Label for terminal block 5mm white - 209-666
4017332397209;WAGO Kontakttechnik 793-666 (5 Stück) - Label for terminal block 17,5mm white - 793-666
4028177926813;Rittal SV 9681.666 - Dachblech BT: 600x600mm, IP 55 SV 9681.666
4046719350353;3M Telecommunications 43018-666 31 - Patch panel copper - 43018-666 31
4050821255475;WAGO 750- 666/000- 003 SPS- Erweiterungsmodul 750- 666/000- 003 1St.
4050821255482;WAGO 753- 666/000- 003 SPS- Erweiterungsmodul 753- 666/000- 003 1St.
666222050515;Creatine 300gr MHP
666222074108;Glutamine- SR 1kg - MHP
666222092003;Xpel (20 uni.) MHP
666222093451;Probolic- SR 1999g Chocolate MHP
666222093499;Probolic- SR 908gr - MHP- Cookies'n Cream
666222093864;IsoPrime 100% Beef 840g MHP Baunilha Caramelizada
666222093932;XPel MHP
6666666666666;Projetor Optoma X600 Full 3D Lum 6000 Cont. 10000
667528021087;Consumo Victorias Secret Charm Body Lotion 250 Ml
667538086298;Victoria's Secret Hidratante Creme Corp. Love Spell Feminino 236Ml Victoria Secret
6687050012296;SOUND CRAFT Mesa de Som 22 Canais Signature SOUNDCRAFT
67103022292;Não foi possível retornar o EAN do produto
67103137477;Não foi possível retornar o EAN do produto
67103336658;Não foi possível retornar o EAN do produto
672042092598;Dissipador de Calor CPU Server 24351- 9 Supermicro
67212224;Não foi possível retornar o EAN do produto
673419247047;LEGO United States Capitol Building
673419247115;Lego Star Wars Pack De Combate Resistência 75131
673419248129;75116 Lego Star Wars Finn.
673419248358;Lego Ninjago Filme - Bomber Arraia 70609
673419248389;Lego Ninjago Filme - Dragão do Ninja Verde 70612
673419249058;75113 Lego Star Wars Rey
673419249430;71012 Lego Minifigures Disney P10 Pato Donald
673419250368;Lego Super Heroes Interceçao de Kryptonite 76045
673419250412;76050 Lego Super Heroes Guerra Civil - Assalto de Risco Dos Ossos Cruzados
673419250443;76053 Lego Dc Comics Batman: Perseguição De Moto Em Gotham
673419250498;76059 Lego Super Heroes Homem Aranha a Armadilha de Tentáculos de Doc Ock
673419264952;41307 Lego Friends o Laboratório Criativo da Olívia
673419265447;10849 Lego Duplo o Meu Primeiro Avião
673419266383;76068 Lego Super Heroes - Poderosos Micros - Super Homem Contra Bizarro
673419266475;31057 Lego Creator Air Blazer
673419266918;75176 Lego Star Wars - Resistance Transport Pod
673419266963;76078 Lego Marvel Hulk Contra Hulk Vermelho
673419267038;Lego Super Heroes 76085 Combate de Atlantis - Lego
673419267366;10703 Lego Classic - Caixa Criativa de Construção
673419279628;LEGO Creator - 3 em 1 - Drone Explorador - 31071
673419279758;LEGO City - Airshow Jet - 60177
673419279833;Lego City Transporte De Carga Pesada 60183
